id,covidence_id,pathogen,first_author_first_name,first_author_surname,article_title,doi,journal,year_publication,volume,issue,page_first,page_last,paper_copy_only,notes,qa_m1,qa_m2,qa_a3,qa_a4,qa_d5,qa_d6,qa_d7,covidence_id_text,double_extracted,article_label,model_only,article_qa_score
9dbbeaaa08c3a04cf73afdee4fbdcc57,3533,Ebola virus,S,Jiang,Mathematical models for devising the optimal Ebola virus disease eradication,10.1186/s12967-017-1224-6,J Transl Med,2017,15,1,124,NA,FALSE,NA,No,No,Yes,Yes,NA,NA,NA,3533,0,Jiang 2017,1,50
59032ec7cfcea009b82c1a05b9c7eed2,3569,Ebola virus,Petrus,Jansen van Vuren,"Phylodynamic Analysis of Ebola Virus Disease
Transmission in Sierra Leone",10.3390/v11010071,Viruses,2019,11,71,NA,NA,FALSE,Difference between delays are before and after set up of ETUs,Yes,Yes,NA,NA,Yes,Yes,Yes,3569,0,Jansen van Vuren 2019,0,100
83ab1cb16848757fc3b925c87f96b33c,3607,Ebola virus,Karly A.,Jacobsen,"The large graph limit of a stochastic epidemic
model on a dynamic multilayer network",10.1080/17513758.2018.1515993,Journal of Biological Dynamics,2018,12,1,746,788,FALSE,SIR continuous-time stochastic process on a multilayer graph,Yes,Yes,Yes,Yes,NA,NA,NA,3607,0,Jacobsen 2018,1,100
5ba650dcb43af61abb2300561c7667c2,3635,Ebola virus,D. L.,Heymann;,Ebola Hemorrhagic Fever: Tandala; Zaire; 1977-1978,NA,Journal of Infectious Diseases,1980,142,3,372,376,FALSE,IIF test used. Reports country as Zaire,No,No,Yes,No,Yes,No,No,3635,0,Heymann; 1980,0,28.57142857142857
985d67c89f741a4226fc5c66d5bb718f,3663,Ebola virus,Patricia C.,Henwood,"Ebola Virus Disease and Pregnancy: A Retrospective
Cohort Study of Patients Managed at 5 Ebola Treatment
Units in West Africa",10.1093/cid/cix290,Clinical Infectious Diseases,2017,65,NA,292,299,FALSE,Compares outcomes for pregnant and non-pregnant women.,Yes,No,Yes,No,Yes,Yes,Yes,3663,0,Henwood 2017,0,71.42857142857143
009eb033555fc8f006722cf2b0820482,3681,Ebola virus,Stephane,Helleringer,Assessing the Direct Effects of the Ebola Outbreak on Life Expectancy in Liberia; Sierra Leone andGuinea,10.1371/currents.outbreaks.01a99f8342b42a58d806d7d1749574ea,PLOS Currents Outbreaks,2015,7,NA,NA,NA,FALSE,NA,Yes,Yes,Yes,Yes,Yes,Yes,Yes,3681,0,Helleringer 2015,0,100
ae85889304225ecf85e09cf3543d4c6b,3686,Ebola virus,Richard,Heffernan,Low seroprevalence of IgG antibodies to Ebola virus in an epidemic zone: Ogooue-Ivindo region; Northeastern Gabon; 1997,10.1086/427994,Journal of Infectious Diseases,2005,191,6,964,968,FALSE,Records seroprevalence and separates by previous vs no previously known EVD infection,Yes,Yes,NA,NA,Yes,Yes,NA,3686,0,Heffernan 2005,0,100
4c7ba0e4c7693c8ce83feffe2180c7c3,3776,Ebola virus,A,Khan,The reemergence of Ebola hemorrhagic fever; Democratic Republic of the Congo; 1995,10.1086/514306,The Journal of Infectious Diseases,1999,179,1,76,86,FALSE,NA,No,No,No,Yes,Yes,Yes,No,3776,0,Khan 1999,0,42.857142857142854
c3a8b3899867e78d138ea8f86ebf53ea,3777,Ebola virus,Adnan,Khan,Estimating the basic reproductive ratio for the Ebola outbreak in Liberia and Sierra Leone,10.1186/s40249-015-0043-3,Infectious Diseases of Poverty,2015,4,13,NA,NA,FALSE,NA,Yes,No,Yes,No,No,No,No,3777,0,Khan 2015,0,28.57142857142857
2bbb735e6e0cf2d53f56b94a32459a4a,3778,Ebola virus,Abdul,Khaleque,An empirical analysis of the Ebola outbreak in West Africa,10.1038/srep42594,Scientific Reports,2017,7,NA,NA,NA,FALSE,NA,No,No,No,No,NA,NA,NA,3778,0,Khaleque 2017,1,0
ea2e6961fd4c1f78021223bf26ac3180,3809,Ebola virus,Daniel,Kelly,Projections of Ebola outbreak size and duration with and without vaccine use in Equateur; Democratic Republic of Congo; as of May 27; 2018,10.1371/journal.pone.0213190,PLOS ONE,2019,14,3,NA,NA,FALSE,NA,No,No,No,Yes,Yes,No,No,3809,0,Kelly 2019,0,28.57142857142857
1abb68afb49d388ac7849f09fe68f277,3814,Ebola virus,Daniel,Kelly,Anatomy of a Hotspot: Chain and Seroepidemiology of Ebola Virus Transmission; Sukudu; Sierra Leone; 2015-16,10.1093/infdis/jiy004,Journal of Infectious Disease,2018,217,8,1214,1221,FALSE,serostudy of quarantined household in Sukudu (Sierra Leone),Yes,No,Yes,Yes,Yes,Yes,Yes,3814,0,Kelly 2018,0,85.71428571428571
da1e78b6b432d204e479b5b1d387a696,3822,Ebola virus,Alpha, Keita,Serological Evidence of Ebola Virus Infection in Rural Guinea before the 2014 West African Epidemic Outbreak,10.4269/ajtmh.18-0105,American Journal of Tropical Medicine and Hygiene,2018,99,2,425,427,FALSE,NA,Yes,Yes,NA,NA,Yes,Yes,Yes,3822,0, Keita 2018,0,100
13e619ed9c6e71ca9c7e119c32dc4d18,3854,Ebola virus,Mary-Anne,Hartley,Predicting Ebola Severity: A clinical Prioritization Score for Ebola Virus Disease,10.1371/journal.pntd.0005265,PLOS Neglected Tropical Diseases,2017,11,2,NA,NA,FALSE,Sample size Ebola(+) patients: 158 however sample size for OR calculations for mortality associated with particular symptoms (>20 distinct types) varies according to number of patients with that observed symptom who survived/died. # Not recorded.,Yes,Yes,NA,NA,Yes,No,No,3854,0,Hartley 2017,0,60
12515bef4d0c1b2c9e427bbd847ec702,3924,Ebola virus,Alexander,Gutfraind,Evaluating large-scale blood transfusion therapy for the current Ebola epidemic in Liberia,10.1093/infdis/jiv042,The Journal of Infectious Diseases,2015,211,8,1262,1267,FALSE,NA,Yes,Yes,Yes,Yes,NA,NA,NA,3924,0,Gutfraind 2015,1,100
e2b03f1873072b396bf10d8ed97af555,3927,Ebola virus,Kyle, Gustafson,Identifying spatio-temporal dynamics of Ebola in Sierra Leone using virus genomes,10.1098/rsif.2017.0583,Journal of the Royal Society Interface,2017,14,136,NA,NA,FALSE,NA,Yes,Yes,Yes,Yes,NA,NA,NA,3927,0, Gustafson 2017,1,100
31f6d7a4baafacc48c7990665226f3dd,3940,Ebola virus,Zuiyuan,Guo,Predicting and Evaluating the Epidemic Trend of Ebola Virus Disease in the 2014-2015 Outbreak and the Effects of Intervention Measures,10.1371/journal.pone.0152438,PLoS One,2016,11,4,NA,NA,FALSE,NA,Yes,No,Yes,Yes,NA,NA,NA,3940,0,Guo 2016,1,75
54a351284893a188d0440b61006d0e8a,4057,Ebola virus,Jean,Paul Gonzalez,Ebola and Marburg virus antibody prevalence in selected populations of the Central African Republic,NA,Microbes and Infection,2000,2,1,39,44,FALSE,NA,Yes,Yes,NA,NA,No,No,No,4057,0,Paul Gonzalez 2000,0,40
9561d38dafff9848bcd414a8c75c774f,4066,Ebola virus,Benjamin,Ivorra,Be-CoDiS: A Mathematical Model to Predict the Risk of Human Diseases Spread Between Countries—Validation and Application to the 2014–2015 Ebola Virus Disease Epidemic,10.1007/s11538-015-0100-x,Bulletin of Mathematical Biology,2015,77,NA,1668,1704,FALSE,Between-Countries Dis- ease Spread (Be-CoDiS) Spatio-temporal model.  No uncertainty intervals,No,No,Yes,Yes,Yes,No,No,4066,0,Ivorra 2015,0,42.857142857142854
9d1c6853da46ddd9094bb97660a68ab1,4095,Ebola virus,Brecht,Ingelbeen,Mortality among PCR negative admitted Ebola suspects during the 2014/15 outbreak in Conakry; Guinea: A retrospective cohort study,10.1371/journal. pone.0180070,PLOS One,2017,12,6,NA,NA,FALSE,Table has 4 day delay between,Yes,No,Yes,Yes,Yes,Yes,No,4095,0,Ingelbeen 2017,0,71.42857142857143
6ac95bfa7988cd1ddee73bcb8414dd53,4155,Ebola virus,Ying-Hen,Hsieh,Temporal Course of 2014 Ebola Virus Disease (EVD) Outbreak in West Africa Elucidated through Morbidity and Mortality Data: A Tale of Three Countries,10.1371/journal.pone.0140810,PLOS One,2015,10,11,NA,NA,FALSE,Fit to commulative data.,Yes,No,Yes,No,No,No,No,4155,0,Hsieh 2015,0,28.57142857142857
bd12a23f10144b808a54a3c578c8469c,4168,Ebola virus,Catherine F.,Houlihan,Ebola exposure; illness experience; and Ebola antibody prevalence in international responders to the West African Ebola epidemic 2014–2016: A cross-sectional study,10.1371/journal.pmed.1002300,PLOS Medicine,2017,14,5,NA,NA,FALSE,The two people don't test positive on all of the tests; just some.  Healthcare workers who returned to UK,Yes,Yes,Yes,Yes,Yes,Yes,Yes,4168,0,Houlihan 2017,0,100
dea5b582f50504f58679ce6e8994cbb6,4206,Ebola virus,Nicole A.,Hoff,Serologic Markers for Ebolavirus Among Healthcare Workers in the Democratic Republic of the Congo,10.1093/infdis/jiy499,Journal of Infectious Diseases,2019,219,NA,517,525,FALSE,"4 different seroprevalance assays.  2 IgG (GP & NP) ; V40 reactive and ""demonstrated neutralisation""",Yes,Yes,NA,NA,Yes,No,No,4206,0,Hoff 2019,0,60
b575953f8353bd8595df122ad02f84c8,4209,Ebola virus,T.,Hoenen,Mutation rate and genotype variation of Ebola virus from Mali case sequences,10.1126/science.aaa5646,Science,2015,348,6230,117,119,FALSE,NA,Yes,Yes,Yes,Yes,Yes,No,NA,4209,0,Hoenen 2015,0,83.33333333333334
f6043af7cd7513284550776722c485ea,4232,Ebola virus,Diana,Gomez-Barroso,Spread of Ebola virus disease based on the density of roads in West Africa,10.4081/gh.2017.552,Geospatial Health,2017,12,2,552,NA,FALSE,NA,Yes,Yes,NA,NA,Yes,Yes,No,4232,0,Gomez-Barroso 2017,0,80
e80578ee1b400afd0c68c5ff8f0180bc,4233,Ebola virus,Marcelo, Gomes,Assessing the international spreading risk associated with the 2014 west african ebola outbreak,10.1371/currents.outbreaks.cd818f63d40e24aef769dda7df9e0da510.1371/currents.outbreaks.cd818f63d40e24aef769dda7df9e0da5,PLoS Currents Outbreaks,2014,6,NA,NA,NA,FALSE,NA,Yes,Yes,Yes,Yes,Yes,Yes,No,4233,0, Gomes 2014,0,85.71428571428571
b274e90d83bce0636167306af42fe120,4253,Ebola virus,Judith, Glynn,Variability in Intrahousehold Transmission of Ebola Virus; and Estimation of the Household Secondary Attack Rate,10.1093/infdis/jix579,The Journal of Infectious Diseases,2018,217,2,232,237,FALSE,When establishing attack rates used an adjustment; so multiple attack rate values given; have extracted range.,Yes,Yes,Yes,Yes,Yes,Yes,Yes,4253,0, Glynn 2018,0,100
4470530245f8791ff125b41e41ec2387,4254,Ebola virus,Judith,Glynn,Asymptomatic infection and unrecognised Ebola virus disease in Ebola-affected households in Sierra Leone: a cross-sectional study using a new non-invasive assay for antibodies to Ebola virus,10.1016/s1473-3099(17)30111-1,Lancet Infectious Diseases,2017,17,6,645,653,FALSE,NA,Yes,Yes,NA,NA,Yes,Yes,NA,4254,0,Glynn 2017,0,100
4f9a15ccb1428d57eb1ae18a554ba659,4257,Ebola virus,B., Gleason,Geospatial analysis of household spread of Ebola virus in a quarantined village - Sierra Leone; 2014,10.1017/s0950268817001856,Epidemiology Infections,2017,145,14,2921,2929,FALSE,Risk factor analysis at the  household level. 64 households (97 houses) but 863 people. 'Sample size' recorded here as number of households as parameter takes the perspective of households' risk. Risk factors listed as 'other' = household size; time.,Yes,Yes,NA,NA,Yes,Yes,No,4257,0, Gleason 2017,0,80
c2762b26ce69105edf211c5c51472003,4268,Ebola virus,Stephen, Gire,Genomic surveillance elucidates Ebola virus origin and transmission during the 2014 outbreak,10.1126/science.1259657,Science,2014,345,6202,1369,1372,FALSE,NA,Yes,Yes,Yes,Yes,Yes,Yes,NA,4268,0, Gire 2014,0,100
447edc7e0e1a24facdcc7ebf0cb49a8c,4301,Ebola virus,Wayne M.,Getz,Tactics and Strategies for Managing Ebola Outbreaks and the Salience of Immunization,10.1155/2015/736507,Computational and Mathematical Methods in Medicine,2015,2015,NA,NA,NA,FALSE,R0 estimates are from the offspring distributions in the output of their model (p3). There are other estimates of R0 with a different value for lambda(t) in the supplement. R0 and doubling time estimates are from model runs; not data.,Yes,Yes,Yes,Yes,NA,NA,NA,4301,0,Getz 2015,1,100
23dd3cabc192a05f50c7ffd5e4659383,4302,Ebola virus,WM,Getz,Discrete stochastic analogs of Erlang epidemic models,10.1080/17513758.2017.1401677,Journal of Biological Dynamics,2018,12,1,NA,NA,FALSE,Models with Erlang probabilities were compared,Yes,Yes,Yes,No,NA,NA,NA,4302,0,Getz 2018,1,75
9c75fc4cb86af78dba8c574e4528904b,4364,Ebola virus,Tini,Garske,Heterogeneities in the case fatality ratio in the West African Ebola outbreak 2013-2016,10.1098/rstb.2016.0308,Phil. Trans. R. Soc. B,2016,372,NA,NA,NA,FALSE,A lot of information in plots about CFR disaggregated by age; time; hospitalization status; and treatment centre.,Yes,Yes,Yes,Yes,Yes,Yes,Yes,4364,0,Garske 2016,0,100
cef95cbf0d08f2931becfcfd5dac3eea,4387,Ebola virus,Tapiwa,Ganyani,Assessing the relationship between epidemic growth scaling and epidemic size: the 2014-2016 Ebola outbreak in West Africa,10.1017/S0950268818002819,Epidemiology and Infection,2018,147,NA,1,6,FALSE,Generalized growth model,Yes,Yes,Yes,Yes,NA,NA,NA,4387,0,Ganyani 2018,1,100
0845ab562ec916166b0e7c04d10093e1,4407,Ebola virus,Robert H.,Gaffey,Application of the CDC EbolaResponse Modeling tool to disease predictions,10.1016/j.epidem.2017.03.001,Epidemics,2018,22,NA,22,28,FALSE,Fitted to synthetic data,No,Yes,Yes,No,NA,NA,NA,4407,0,Gaffey 2018,1,50
e6f341f339d0bd50fb85d841117e9302,4417,Ebola virus,Yuki,Furuse,Analysis of patient data from laboratories during the Ebola virus disease outbreak in Liberia; April 2014 to March 2015,10.1371/journal.pntd.0005804,PLOS Neglected Tropical Diseases,2017,11,7,NA,NA,FALSE,NA,Yes,Yes,Yes,Yes,Yes,Yes,Yes,4417,0,Furuse 2017,0,100
b3615519d95f1d4ad6a1bd4dab4d6935,4420,Ebola virus,S,Funk,The impact of control strategies and behavioural changes on the elimination of Ebola from Lofa County; Liberia,10.1098/rstb.2016.0302,The Royal Society,2017,372,1721,NA,NA,FALSE,NA,Yes,Yes,Yes,Yes,Yes,Yes,Yes,4420,0,Funk 2017,0,100
7a3881ece1334c4c0d4329c32076ffda,4421,Ebola virus,Sebastian,Funk,Assessing the performance of real-time epidemic forecasts: A case study of Ebola in the Western Area region of Sierra Leone; 2014-15,10.1371/journal.pcbi.1006785,PLoS Comput Biol,2019,15,2,NA,NA,FALSE,NA,Yes,Yes,Yes,Yes,Yes,Yes,Yes,4421,0,Funk 2019,0,100
e7fd7e97770e579ee51e3161bf8fd6ba,4422,Ebola virus,Sebastian,Funk,Real-time forecasting of infectious disease dynamics with a stochastic semi-mechanistic model,10.1016/j.epidem.2016.11.003,Epidemics,2018,22,NA,56,61,FALSE,NA,Yes,Yes,Yes,Yes,NA,NA,NA,4422,0,Funk 2018,1,100
a934e5ee5bd4c78f51556edfa34b925a,4500,Ebola virus,Gianluca,Frasso,Bayesian inference in an extended SEIR model with nonparametric disease transmission rate: an application to the Ebola epidemic in Sierra Leone,10.1093/biostatistics/kxw027,Biostatistics,2016,17,4,779,792,FALSE,NA,Yes,Yes,Yes,Yes,Yes,Yes,Yes,4500,0,Frasso 2016,0,100
78c2ed7fdaf7cdf3d287e318be1f3e46,4507,Ebola virus,Paolo,Francesconi,Ebola hemorrhagic fever transmission and risk factors of contacts; Uganda,10.3201/eid0911.030339,Emerg Infect Dis,2003,9,11,1430,1437,FALSE,"20 (/24 incl infants) post-primary cases were mostly housewives or subsistence farmers.
Risk factors for funeral; close-contact; and household contact are more detailed in paper.
Underpowered.",Yes,Yes,No,No,Yes,Yes,No,4507,1,Francesconi 2003,0,57.14285714285714
a4616a78c4e73f2dbf15ba0197386630,4536,Ebola virus,Onikepe,Folarin,Ebola Virus Epidemiology and Evolution in Nigeria,10.1093/infdis/jiw190,The Journal of Infectious Diseases,2016,214,NA,102,109,FALSE,These onset - outcome time delays are all for close contacts who were under surveillance and so may not be representative. The onset-admission delays are for survivors (ID 277) and nonsurvivors (ID 278).,Yes,No,NA,NA,Yes,No,No,4536,0,Folarin 2016,0,40
de9a243835d83a0ff82edda1e4841fd8,4557,Ebola virus,Gabriel,Fitzpatrick,The Contribution of Ebola Viral Load at Admission and Other Patient Characteristics to Mortality in a Médecins Sans Frontières Ebola Case Management Centre; Kailahun; Sierra Leone; June–October 2014,10.1093/infdis/jiv304,The Journal of Infectious Diseases,2015,212,11,1752,1758,FALSE,NA,Yes,Yes,NA,NA,Yes,Yes,No,4557,0,Fitzpatrick 2015,0,80
5a59041cc21bc2f0ab8e80bdb0edc8c9,4562,Ebola virus,Felicity,Fitzgerald,Ebola Virus Disease in Children; Sierra Leone; 2014–2015,10.3201/eid2210.160579,Emerging Infectious Diseases,2016,22,10,1769,1777,FALSE,This is an observational study (with calculated CFRs; risk factors and human delays). There doesn't seem to be anywhere to indicate this; so leaving a note here.,Yes,Yes,NA,NA,Yes,Yes,No,4562,0,Fitzgerald 2016,0,80
f2c96e82d56d69f19705547cc872faad,4568,Ebola virus,D,Fisman,Projected Impact of Vaccination Timing and Dose Availability on the Course of the 2014 West African Ebola Epidemic,10.1371/currents.outbreaks.06e00d0546ad426fed83ff24a1d4c4cc,PLOS Currents Outbreaks,2014,6,NA,NA,NA,FALSE,NA,Yes,No,No,No,No,Yes,No,4568,0,Fisman 2014,0,28.57142857142857
24932086f736732063914c1e8ed69acb,4569,Ebola virus,David,Fisman,Early Epidemic Dynamics of the West African 2014 Ebola Outbreak: Estimates Derived with a Simple Two-Parameter Model,10.1371/currents.outbreaks.89c0d3783f36958d96ebbae97348d571,PLOS Current Outbreaks,2014,6,NA,NA,NA,FALSE,NA,Yes,No,No,No,No,Yes,No,4569,0,Fisman 2014,0,28.57142857142857
d6a06a2d65f9cbb757ad8b0e245467ef,4607,Ebola virus,Zhilan,Feng,Mathematical models of Ebola—Consequences of underlying assumptions,10.1016/j.mbs.2016.04.002,Mathematical Biosciences,2016,277,NA,89,107,FALSE,NA,Yes,Yes,Yes,Yes,NA,NA,NA,4607,0,Feng 2016,1,100
532070f37107a9c1345a1976c499a7ad,4642,Ebola virus,Wayne T.A.,Enanoria,"Evaluating Subcriticality during the Ebola
Evaluating Subcriticality during the Ebola Epidemic in West Africa","10.1371/
10.1371/journal.pone.0140651",PLoS ONE,2015,10,10,NA,NA,FALSE,Information about  R estimates in plots for Guinea; Sierra Leone; and Liberia.,Yes,Yes,Yes,Yes,Yes,Yes,No,4642,0,Enanoria 2015,0,85.71428571428571
29095ccc508ec89f2213c2c2a7b41307,4679,Ebola virus,Martin,Eichner,Incubation Period of Ebola Hemorrhagic Virus Subtype Zaire,10.1016/j.phrp.2011.04.001,Public Health Res Perspect,2011,2,1,3,7,FALSE,Also household contacts of cases who died,Yes,Yes,Yes,Yes,Yes,Yes,No,4679,0,Eichner 2011,0,85.71428571428571
a53dcb372205e393c707485f4d0060e6,4763,Ebola virus,G,Dudas,Phylogenetic Analysis of Guinea 2014 EBOV Ebolavirus Outbreak,10.1371/currents.outbreaks.84eefe5ce43ec9dc0bf0670f7b8b417d,PLOS Current Outbreaks,2014,2,1,NA,NA,FALSE,NA,Yes,Yes,NA,NA,Yes,No,No,4763,0,Dudas 2014,0,60
8e3757ced5a2b2fc462ddc22177ee117,4764,Ebola virus,Gytis,Dudas,Virus genomes reveal factors that spread and sustained the Ebola epidemic,doi:10.1038/nature22040,Nature,2017,544,NA,309,315,FALSE,Two different statistical models: 1) phylogeographic GLM to identify factors that influenced spread of EBOV at sub-national level; 2) Bayesian GLM to predict cumulative case counts per region.,Yes,Yes,Yes,Yes,Yes,Yes,No,4764,0,Dudas 2017,0,85.71428571428571
35d0e782670910a8491fb3c5b85c1266,4766,Ebola virus,Sebastien,Duchene,Phylodynamic Model Adequacy Using Posterior Predictive Simulations,10.1093/sysbio/syy048,Software for Systematics and Evolution,2019,68,2,358,364,FALSE,Disaggregated by phlyogenetic model used (birth-death (BD); coalescent exponential growh (CE); birth-death susceptible-infectious-recovered (BDSIR)).,No,Yes,Yes,Yes,Yes,No,No,4766,0,Duchene 2019,0,57.14285714285714
e004401277e06b07327016d2564f0675,4778,Ebola virus,Jeremy,D'Silva,Modeling spatial invasion of Ebola in West Africa,10.1016/j.jtbi.2017.05.034,Journal of Theoretical Biology,2017,428,NA,65,75,FALSE,NA,Yes,No,Yes,Yes,Yes,Yes,No,4778,0,D'Silva 2017,0,71.42857142857143
edc64ab2acec2f2349703d0b2e11e06e,4787,Ebola virus,John,Drake,Ebola cases and health system demand in Liberia,10.1371/journal.pbio.1002056,PLOS Biology,2015,13,1,NA,NA,FALSE,NA,No,No,Yes,Yes,Yes,Yes,No,4787,0,Drake 2015,0,57.14285714285714
f7956deecad11d697b5c0958e78fa2ce,4796,Ebola virus,Scott,Dowell,Transmission of Ebola hemorrhagic fever: a study of risk factors in family members; Kikwit; Democratic Republic of the Congo; 1995,10.1086/514284,The Journal of Infectious Diseases,1999,1791,1,87,91,FALSE,"Investigation of households with EBOV cases in Kikwit
Close contact a significant risk factor during late illness; but not significant during incubation period & early illness",Yes,Yes,Yes,Yes,Yes,Yes,No,4796,0,Dowell 1999,0,85.71428571428571
8f8d610e882511960e8c146266b6c8bb,4811,Ebola virus,Fangliang,Dong,Evaluation of Ebola spreading in West Africa and decision of optimal medicine delivery strategies based on mathematical models,10.1016/j.meegid.2015.09.003,Infection; Genetics and Evolution,2015,36,NA,35,40,FALSE,NA,No,No,No,No,Yes,No,No,4811,0,Dong 2015,0,14.285714285714285
29f4a5e5b7563e91b43d6f68a735e80d,4828,Ebola virus,TS,Do,Modeling the Spread of Ebola,10.1016/j.phrp.2015.12.012,Osong Public Health Res Perspect,2016,7,1,43,48,FALSE,NA,No,No,No,Yes,No,No,No,4828,0,Do 2016,0,14.285714285714285
162be80f6cf9aab33e695807287b6eea,4829,Ebola virus,M,Dixon,Contact Tracing Activities during the Ebola Virus Disease Epidemic in Kindia and Faranah; Guinea; 2014,10.3201//eid2111.150684,Emerging Infectious Diseases,2015,21,11,2022,2028,FALSE,contact tracing study. Most case-patients were not previously registered and followed up on as contacts before case identification.,Yes,Yes,NA,NA,Yes,Yes,No,4829,0,Dixon 2015,0,80
08106f38343dabc363c762ae90e92229,4860,Ebola virus,Mads,Damkjaer,Clinical Features and Outcome of Ebola Virus Disease in Pediatric Patients: A Retrospective Case Series,10.1016/j.jpeds.2016.11.034,The Journal of Pediatrics,2017,182,NA,378,381,FALSE,"EVD in children
admission viral load risk factor for death as outcome",Yes,Yes,Yes,Yes,Yes,No,No,4860,0,Damkjaer 2017,0,71.42857142857143
440914b7d991dac90628a383005d9a1f,4862,Ebola virus,BD,Dalziel,Unreported cases in the 2014-2016 Ebola epidemic: Spatiotemporal variation; and implications for estimating transmission,10.1371/journal.pntd.0006161,PLoS Neglected Tropical Diseases,2018,12,1,NA,NA,FALSE,This estimates reporting rates of cases - as far as I can see we don't extract those but this is still interesting. There are estimates of Rt but they are in time series format and in a figure only (with and without adjusting for underreporting).,Yes,Yes,Yes,Yes,Yes,Yes,Yes,4862,0,Dalziel 2018,0,100
e455fe95639b26c6a37aa10377e0a00d,4865,Ebola virus,S,Dallatomasina,Ebola outbreak in rural West Africa: epidemiology; clinical features and outcomes,10.1111/tmi.12454,Tropical Medicine and International Health,2015,20,4,NA,NA,FALSE,"Disaggregation of time in care by outcome. Also have an estimate of the number of contacts for the cases. The ""infectious period"" is refered to by ""community infectious period"" within this paper (assuming they correspond).",Yes,Yes,Yes,Yes,Yes,Yes,No,4865,0,Dallatomasina 2015,0,85.71428571428571
6c8d53076a3992eff030b45a9d29f9ae,4900,Ebola virus,SJ,Crowe,Prognostic Indicators for Ebola Patient Survival,10.3201/eid2202.151250,Emerging Infectious Diseases,2016,22,2,NA,NA,FALSE,NA,Yes,Yes,Yes,Yes,Yes,Yes,No,4900,0,Crowe 2016,0,85.71428571428571
560e8980dc7a2589a53504e21ec5f1f6,4966,Ebola virus,O,Faye,Chains of transmission and control of Ebola Virus Disease in Conakry; Guinea in 2014,10.1016/S1473-3099(14)71075-8,Lancet Infectious Disease,2015,15,3,320,326,FALSE,Also gives the percentage of transmissions occuring in different settings,Yes,Yes,Yes,Yes,Yes,Yes,No,4966,0,Faye 2015,0,85.71428571428571
622cb5360bb4c688adc98279ef257c9b,4967,Ebola virus,O,Faye,Use of Viremia to Evaluate the Baseline Case Fatality Ratio of Ebola Virus Disease and Inform Treatment Studies: A Retrospective Cohort Study,10.1371/journal.pmed.1001908,PLoS Medicine,2015,12,12,NA,NA,FALSE,'Other' endpoint for delay time is time to sample being collected.,Yes,Yes,Yes,Yes,Yes,No,No,4967,0,Faye 2015,0,71.42857142857143
41ac69c3302b427816b417d8087272b5,4969,Ebola virus,O,Fawole,Gender dimensions to the Ebola outbreak in Nigeria,10.4103/1596-3519.172554,Annals of African Medicine,2016,15,1,7,13,FALSE,NA,Yes,No,NA,NA,Yes,No,No,4969,0,Fawole 2016,0,40
88cb2206fc49b58a6588bc1d1198b95d,4981,Ebola virus,FO,Fasina,Transmission dynamics and control of Ebola virus disease outbreak in Nigeria; July to September 2014,10.2807/1560-7917.es2014.19.40.20920,Eurosurveillance,2014,19,40,NA,NA,FALSE,NA,Yes,Yes,Yes,Yes,Yes,No,No,4981,0,Fasina 2014,0,71.42857142857143
f16f35a67dc98dcff4f4c903a37aae47,4991,Ebola virus,Li-Qun,Fang,Transmission dynamics of Ebola virus disease and intervention effectiveness in Sierra Leone,10.1073/pnas.1518587113,PNAS,2016,113,16,4488,4493,FALSE,Unspecified attack rate uses all data available to make an overall estimate. Mid outbreak estimate is from data prior to the implementation of interventions; and end outbreak estimate is from the period after interventions were implemented.,Yes,Yes,Yes,Yes,Yes,No,No,4991,0,Fang 2016,0,71.42857142857143
9369b177742174e5b4eeed082c66fa2d,5005,Ebola virus,Mosoka P.,Fallah,Quantifying Poverty as a Driver of Ebola Transmission,10.1371/journal.pntd.0004260,PLOS Neglected Tropical Diseases,2015,9,12,NA,NA,FALSE,"Gamma distribution for survivors (Gamma(2.8640; 3.5058)) and non-survivors (Gamma (2.5988; 3.3515)).
Risk factor is SES status for onward transmission.",No,Yes,Yes,No,Yes,No,No,5005,0,Fallah 2015,0,42.857142857142854
5f37e98e024eb7c15d8d2e177f914cb5,5033,Ebola virus,Robin J.,Evans,Dynamcis of Ebola Epidemics in West Africa 2014,10.12688/f1000research.5941.2,F1000Research,2015,3,319,NA,NA,FALSE,NA,Yes,No,Yes,No,Yes,No,No,5033,0,Evans 2015,0,42.857142857142854
a420eb8489a5cf26966bab58c7dbe13a,5057,Ebola virus,RC,Cope,Assessment of the Risk of Ebola Importation to Australia,10.1371/currents.outbreaks.aa0375fd48a92c7c9422aa543a88711f,PLOS Current Outbreaks,2014,1,NA,NA,NA,FALSE,NA,Yes,Yes,Yes,Yes,NA,NA,NA,5057,0,Cope 2014,1,100
24e4143bdc20778b496d84c5ab8c55cc,5127,Ebola virus,Julie M.,Cleaton,"Characterizing Ebola Transmission Patterns Based on
Characterizing Ebola Transmission Patterns Based on Internet News Reports",10.1093/cid/civ748,Clinical Infectious Diseases,2016,62,1,24,31,FALSE,NA,Yes,Yes,No,No,No,Yes,No,5127,0,Cleaton 2016,0,42.857142857142854
a4ebed7c50768bba0df9609bc07b0647,5197,Ebola virus,Miles W.,Carroll,Temporal and spatial analysis of the 2014-2015 Ebola virus outbreak in West Africa,10.1038/nature14594,Nature,2015,524,NA,97,102,FALSE,NA,Yes,Yes,Yes,Yes,No,No,No,5197,0,Carroll 2015,0,57.14285714285714
