id,covidence_id,pathogen,first_author_first_name,first_author_surname,article_title,doi,journal,year_publication,volume,issue,page_first,page_last,paper_copy_only,notes,qa_m1,qa_m2,qa_a3,qa_a4,qa_d5,qa_d6,qa_d7,covidence_id_text,double_extracted,article_label,model_only,article_qa_score
7dd94ace514b018ae850610e36442506,15959,Ebola virus,Gerardo,Chowell,Vaccination strategies to control Ebola epidemics in the context of variable household inaccessibility levels,10.1371/journal.pntd.0007814,PLOS Neglected Tropical Diseases,2019,13,11,NA,NA,FALSE,"Ring vaccination; with third ring; in conflict zone (attacks on healthcare workers)
Model fitted to West Africa 2014/15 epidemic; simulations on DRC 2018/19 outbreak.",Yes,Yes,Yes,Yes,NA,NA,NA,15959,0,Chowell 2019,1,100
9deaa2c2503b1d41baa1e83afee23e7c,16174,Ebola virus,MB,DeSilva,Introduction of Ebola virus into a remote border district of Sierra Leone; 2014: use of field epidemiology and RNA sequencing to describe chains of transmission,10.1017/s0950268819000104,Epidemiol Infect,2019,147,NA,NA,NA,FALSE,Reproduction number estimated by 'generation'; only first and last generation given (4 and 1.3; respectively),No,No,NA,NA,Yes,Yes,No,16174,0,DeSilva 2019,0,40
df2c6ce31ce35594f8fd2fa7b3c97e51,16201,Ebola virus,MSK,Diallo,Temporal evolution of the humoral antibody response after Ebola virus disease in Guinea: a 60-month observational prospective cohort study,10.1016/s2666-5247(21)00170-1,Lancet Microbe,2021,2,12,NA,NA,FALSE,IgG seropositivity among EBOV survivors based on a multivariate logistic regression model; overall numerator and denominator not given. Paper also has info on cross-reactivity with other Ebola strains.,Yes,Yes,NA,NA,Yes,Yes,Yes,16201,0,Diallo 2021,0,100
438d9a2a8ade82b593541bea79b166ae,16216,Ebola virus,Bimandra,Djaafara,A Quantitative Framework for Defining the End of an Infectious Disease Outbreak: Application to Ebola Virus Disease,10.1093/aje/kwaa212,American Journal of Epidemiology,2021,190,4,642,651,FALSE,End of outbreak declaration.,Yes,Yes,Yes,Yes,NA,NA,NA,16216,0,Djaafara 2021,1,100
67a232dd360385891f74f823300381ae,16217,Ebola virus,SD,Djiomba Njankou,Modelling the Role of Human Behaviour in Ebola Virus Disease (EVD) Transmission Dynamics,10.1155/2022/4150043,Comput Math Methods Med,2022,2022,NA,NA,NA,FALSE,SIRD,Yes,No,Yes,Yes,NA,NA,NA,16217,0,Djiomba Njankou 2022,1,75
55df9dc8554b245d76e298711a6850ee,16218,Ebola virus,SDD,Njankou,Modelling the potential influence of human migration and two strains on Ebola virus disease dynamics,10.1016/j.idm.2022.10.002,Infectious Disease Modelling,2022,7,4,645,659,FALSE,Have different strains included within the model,NA,NA,Yes,Yes,NA,NA,NA,16218,0,Njankou 2022,1,100
a2de38b34ab40b657e6cb1724b38d186,16237,Ebola virus,Reena,Doshi,Risk Factors for Ebola Exposure in Health Care Workers in Boende; Tshuapa Province; Democratic Republic of the Congo,10.1093/infdis/jiaa747,The Journal of Infectious Diseases,2022,226,NA,608,615,FALSE,NA,Yes,Yes,NA,NA,Yes,Yes,No,16237,0,Doshi 2022,0,80
c3d9d878adcc188916598ff8c81fa65a,16267,Ebola virus,Gytis,Dudas,The ability of single genes vs full genomes to resolve time and space in outbreak analysis,10.1186/s12862-019-1567-0,BMC Evolutionary Biology,2019,19,232,NA,NA,FALSE,There are four evolutionary rates calculated: two using Bayesian pyhlo model (more accurate but figure only) and two using regression of phylo tree (less accurate); for both whole genome and specific GP gene.,Yes,Yes,Yes,Yes,Yes,No,No,16267,0,Dudas 2019,0,71.42857142857143
1c57f227e87ae09e1ff6a310dc1fb04d,16268,Ebola virus,N,Duffy,Risk factors for Ebola virus disease among household care providers; Sierra Leone; 2015,10.1093/ije/dyac081,International Journal of Epidemiology,2022,51,5,1457,1468,FALSE,Stratify risk factors by carers and non-carers,Yes,Yes,Yes,Yes,Yes,Yes,No,16268,0,Duffy 2022,0,85.71428571428571
283fec68757416f8544d2e3b37bccc50,16279,Ebola virus,Jonathan,Dyal,Risk Factors for Ebola Virus Persistence in Semen of Survivors in Liberia,10.1093/cid/ciac424,Clin Infect Dis,2023,76,3,849,856,FALSE,NA,Yes,No,Yes,Yes,Yes,Yes,No,16279,0,Dyal 2023,0,71.42857142857143
d96c9fab70479a8d7d81536225d2005a,16293,Ebola virus,GCE,Mbah,MATHEMATICAL MODELLING APPROACH OF THE STUDY OF EBOLA VIRUS DISEASE TRANSMISSION DYNAMICS IN A DEVELOPING COUNTRY,10.21010/Ajidv17i1.2,African Journal of Infectious Diseases,2022,17,1,10,26,FALSE,Although transmission parameters are estimated; these are for specific cases within the model (e.g. vaccination and condom use; vaccination without condom use) and so they are unable to be extracted.,Yes,Yes,Yes,Yes,NA,NA,NA,16293,0,Mbah 2022,1,100
86e2702a0e3ff67dd840d672585d6016,16500,Ebola virus,Alpha,Forna,Case Fatality Ratio Estimates for the 2013–2016 West African Ebola Epidemic: Application of Boosted Regression Trees for Imputation,10.1093/cid/ciz678,Clinical Infectious Diseases,2019,70,12,2476,2483,FALSE,Imputation for cases with missing outcome. 1) unadjusted CFR without imputation; 2) unadjusted CFR with imputation; 3) adjusted CFR with imputation. Delays and cfr disaggregations in supplements. Adjusted = corrected for imperfect sensitivity/specificity.,Yes,Yes,Yes,Yes,Yes,Yes,Yes,16500,0,Forna 2019,0,100
7187ee9671317c03085a51ec5be0204e,16561,Ebola virus,SC,Garbem,Effect of Mass Artesunate-Amodiaquine Distribution on Mortality of Patients With Ebola Virus Disease During West African Outbreak,10.1093/ofid/ofz250,Open Forum Infectious Diseases,2019,6,7,NA,NA,FALSE,NA,No,No,NA,Yes,Yes,Yes,No,16561,0,Garbem 2019,0,50
1deb5806511fa19334bd8deed18efb07,16579,Ebola virus,D,Gayedyu-Dennis,Identifying Paucisymptomatic or Asymptomatic and Unrecognized Ebola Virus Disease Among Close Contacts Based on Exposure Risk Assessments and Screening Algorithms,10.1093/infdis/jiac359,J Infect Dis,2023,227,7,878,887,FALSE,Comparing survivors to contacts. Association between degree of exposure and infection; and degree of exposure and severity of illness (as a categorical variable).,Yes,Yes,Yes,Yes,Yes,Yes,No,16579,0,Gayedyu-Dennis 2023,0,85.71428571428571
e0220c68ec83bde9a97abca741c07ccc,16599,Ebola virus,Wayne,Getz,Adequacy of SEIR models when epidemics have spatial structure: Ebola in Sierra Leone,10.1098/rstb.2018.0282,Philosophical Transactions of the Royal Society B,2019,374,NA,NA,NA,FALSE,NA,Yes,Yes,Yes,Yes,Yes,No,No,16599,0,Getz 2019,0,71.42857142857143
5b75cc76b9ce5ce2f05ce934d7f281bd,16643,Ebola virus,T,Goldstein,Spillover of ebolaviruses into people in eastern Democratic Republic of Congo prior to the 2018 Ebola virus disease outbreak,10.1186/s42522-020-00028-1,One Health Outlook,2020,2,21,NA,NA,FALSE,Conducted before the recorded beginning of the outbreak,Yes,Yes,No,Yes,Yes,No,No,16643,0,Goldstein 2020,0,57.14285714285714
d36a2abdaabd9435adf401e029c96527,16691,Ebola virus,William,Green,Inferring the reproduction number using the renewal equation in heterogeneous epidemics,10.6084/m9.figshare.c.5852246,Journal of the Royal Society Interface,2022,19,NA,NA,NA,FALSE,NA,Yes,Yes,Yes,Yes,Yes,Yes,Yes,16691,0,Green 2022,0,100
25f813750f9c68173bbab70229966533,16699,Ebola virus,Karen,Grepin,The socio-economic distribution of exposure to Ebola: Survey evidence from Liberia and Sierra Leone,10.1016/j.ssmph.2019.100472,SSM Popul Health,2020,10,NA,NA,NA,FALSE,Socioeconomic status and exposure to Ebola. Individual-level education as well as an indicator that the household lives in an urban area are both positively and significantly associated with knowing a close friend or family member with Ebola.,Yes,No,Yes,No,Yes,No,No,16699,0,Grepin 2020,0,42.857142857142854
d8eaa5cabf2165a2cf4c7aa92d5ca477,16757,Ebola virus,PJ,Halfmann,Serological analysis of Ebola virus survivors and close contacts in Sierra Leone: A cross-sectional study,10.1371/journal.pntd.0007654,PLoS Neglected Tropical Diseases,2019,13,8,NA,NA,FALSE,NA,Yes,No,NA,NA,Yes,No,No,16757,0,Halfmann 2019,0,40
cd64507e4a91b21ec159c148e23c5db7,16761,Ebola virus,Gustav,Halvorsen,Spatial model of Ebola outbreaks contained by behavior change,10.1371/journal.pone.0264425,PLOS One,2022,17,3,NA,NA,FALSE,NA,Yes,No,No,No,NA,NA,NA,16761,0,Halvorsen 2022,1,25
824dc23771ba134d8d58f07f49cfbcf7,16787,Ebola virus,W.S.,Hart,Accurate forecasts of the effectiveness of interventions against Ebola may require models that account for variations in symptoms during infection,10.1016/j.epidem.2019.100371,Epidemics,2019,29,NA,100371,NA,FALSE,"Model with hetrogeneity in contact rate based on stage of infeciton) in S5.  Additional model in S6 (SEI_1;I_2;I_3;R;D;C).
Refer to ""latent/incubation"" period in params; hence asummption ticked.
R0: 1.83 Variable symptoms;  R0: 1.9 constant symptoms",Yes,No,Yes,Yes,Yes,Yes,No,16787,0,Hart 2019,0,71.42857142857143
5a274e1b73b0165ef15ff97618490c4e,16865,Ebola virus,Andrew,Holbrook,From viral evolution to spatial contagion: a biologically modulated Hawkes model,10.1093/bioinformatics/btac027,Bioinformatics,2022,38,7,1846,1856,FALSE,NA,Yes,Yes,Yes,Yes,NA,NA,NA,16865,0,Holbrook 2022,1,100
eceff8ffd8ff68e18875d771251968d6,16915,Ebola virus,Christine,Hulseberg,Molecular analysis of the 2012 Bundibugyo virus disease outbreak,10.1016/j.xcrm.2021.100351,Cell Reports Medicine,2021,2,NA,NA,NA,FALSE,NA,Yes,Yes,Yes,Yes,Yes,Yes,Yes,16915,0,Hulseberg 2021,0,100
1805eb63ceb24916184d0241108e85d9,16951,Ebola virus,Oly,Ilunga Kalenga,The Ongoing Ebola Epidemic in the Democratic Republic of Congo; 2018-2019,10.1056/NEJMsr1904253,N Engl J Med,2019,381,4,373,383,FALSE,Order of second delay is odd but  Health center visit -> Symptom Onset/Fever; but captured in case.,No,No,No,No,Yes,No,No,16951,0,Ilunga Kalenga 2019,0,14.285714285714285
2960cb0520383859a6ba6a7b83246308,16968,Ebola virus,Iqbal,Zafar,A SEIR model with memory effects for the propagation of Ebola-like infections and its dynamically consistent approximation,10.1016/j.cmpb.2021.106322,Comput Methods Programs Biomed,2021,209,NA,106322,NA,FALSE,NA,Yes,No,No,No,NA,NA,NA,16968,0,Zafar 2021,1,25
66113913392886946bf1f151c713e593,17054,Ebola virus,M,Jeremiah Matson,Evaluation of viral load in patients with Ebola virus disease in Liberia: a retrospective observational study,10.1016/s2666-5247(22)00065-9,Lancet Microbe,2022,3,7,533,542,FALSE,"Disagg by survivor vs. not. Only single IQR given; and dists not symmetric based on violin plot in appendix.
Risk factor: Above a viral load threshold. Two different tests; each w/ a threshold.",NA,NA,NA,NA,NA,NA,NA,17054,0,Jeremiah Matson 2022,0,NA
275d1ae36a75e048aa601393c035a0ee,17077,Ebola virus,Thibaut,Jombart,The cost of insecurity: from flare-up to control of a major Ebola virus disease hotspot during the outbreak in the Democratic Republic of the Congo; 2019,10.2807/1560-7917.Es.2020.25.2.1900735,Euro Surveill,2020,25,2,NA,NA,FALSE,"R calculated using log-linear growth rate model Wallinga and Lipstich’s method; added this as an ""other"" model; but not much info related to the entry. Downvoted on Data QA according to wiki criteria but rapid communication so not much space",Yes,Yes,Yes,No,No,No,No,17077,0,Jombart 2020,0,42.857142857142854
5d8916fa91c8275c99317fd274f9d196,17096,Ebola virus,M.L.,Juga,Modelling the impact of stigmatisation of Ebola survivors on the disease transmission dynamics,10.1038/s41598-023-32040-6,Sci Rep,2023,13,1,4859,NA,FALSE,"Other intervention: Stigmatising survivors.
R0 range is calculated by varying stigma params in a sensitivity analysis - the other params are fitted; but excluded since R0 range is based on simulations and no central estimate with actual parameters.",Yes,No,Yes,No,NA,NA,NA,17096,0,Juga 2023,1,50
d5b7f0f6fcdd9a9a7bdb67176f1e02fd,17097,Ebola virus,M.L.,Juga,An Ebola virus disease model with fear and environmental transmission dynamics,10.1016/j.idm.2021.03.002,Infect Dis Model,2021,6,NA,545,559,FALSE,"R0 available in two separate bivariate contour plots. The fitted params used are included in the range of one of the contour plots so included R0 as availble from figure only.
Other intervention: Pathogens in the environment(included using a compartment)",Yes,No,Yes,No,No,No,No,17097,0,Juga 2021,0,28.57142857142857
3ea09b84391121fa34ac5635deb21bfc,17111,Ebola virus,Rebecca,Kahn,Incubation periods impact the spatial predictability of cholera and Ebola outbreaks in Sierra Leone,10.1073/pnas.1913052117,Proceedings of the National Academy of Sciences,2020,117,9,5067,5073,FALSE,NA,Yes,Yes,Yes,Yes,Yes,Yes,Yes,17111,0,Kahn 2020,0,100
0c218b9e00ae932f6b23d81785c7b6f9,17137,Ebola virus,Jia,Kangbai,Severity score for predicting in-facility Ebola treatment outcome,10.1016/j.annepidem.2020.07.0171047-2797,Annals of Epidemiology,2020,49,NA,68,74,FALSE,NA,Yes,Yes,NA,NA,Yes,Yes,Yes,17137,0,Kangbai 2020,0,100
203fd6e6b4b38d2e3dc0a1e5a9cf60f3,17138,Ebola virus,Jia,Kangbai,Sociodemographic and clinical determinants of in-facility case fatality rate for 938 adult Ebola patients treated at Sierra Leone Ebola treatment center,10.1186/s12879-020-04994-9,BMC Infectious Diseases,2020,20,293,NA,NA,FALSE,NA,Yes,Yes,NA,NA,Yes,Yes,No,17138,0,Kangbai 2020,0,80
e3c5aa6caef0aeb8d544406ed7ced840,17139,Ebola virus,Jia,Kangbai,Factors associated with length of stay and treatment outcome of Ebola patients treated at an Ebola treatment center in Sierra Leone during the peak period of the West African Ebola outbreak 2013–2016,10.1186/s13690-021-00653-w,Archives of Public Health,2021,79,131,NA,NA,FALSE,Article contains two unsig risk factors for death (adj and unadj); two (sig and unsig) risk factors for LOS (for those who recover - IDs 249;250) and two (sig and unsig) risk factors for LOS (for those who die - IDs 251;252).,Yes,Yes,NA,NA,Yes,Yes,No,17139,0,Kangbai 2021,0,80
581daf9622b451beebea8a938a9fe0fe,17157,Ebola virus,Masumbuko,Kasereka,Prior vaccination with recombinant Vesicular Stomatitis Virus - Zaire Ebolavirus vaccine is associated with improved survival among patients with Ebolavirus infection,10.1016/j.vaccine.2020.02.044,Vaccine,2020,38,NA,3003,3007,FALSE,This article presents delays and CFRs for unvax (253-255) and vax(256-258). Data aggregated by vax status is also available; but I did not extract; since it is not comparable. Risk factors for death (259-262); onset-admission delay (300) and LOS(301) also,Yes,Yes,NA,NA,Yes,Yes,Yes,17157,0,Kasereka 2020,0,100
2b0e5c055a2c54974ee79b338376bc7c,17184,Ebola virus,Alpha,Keita,Resurgence of Ebola virus in 2021 in Guinea suggests a new paradigm for outbreaks,10.1038/s41586-021-03901-9,Nature,2021,597,NA,539,543,FALSE,NA,Yes,Yes,Yes,Yes,Yes,No,No,17184,0,Keita 2021,0,71.42857142857143
41f39f391b40c58dba4ef1335eb983e2,17192,Ebola virus,Mory,Keita,A community-based contact isolation strategy to reduce the spread of Ebola virus disease: an analysis of the 2018–2020 outbreak in the Democratic Republic of the Congo,10.1136/bmjgh-2023-011907,BMJ Global Health,2023,8,NA,NA,NA,FALSE,There are two CFRs calculated: one for a group of close-contacts who are isolated and supervised; another for a group of close-contacts who do not isolate,No,No,No,No,Yes,Yes,No,17192,0,Keita 2023,0,28.57142857142857
e50fc9e375c35fe9cbf946dd3f82c126,17200,Ebola virus,J,Kelly,Association of Lower Exposure Risk With Paucisymptomatic/Asymptomatic Infection; Less Severe Disease; and Unrecognized Ebola Virus Disease: A Seroepidemiological Study,10.1093/ofid/ofac052,Open Forum Infectious Diseases,2022,9,4,NA,NA,FALSE,The authors refer to seropositivity of close contacts; which I extracted verbatim as seroprevalence; but I believe that this is actually an attack rate.,No,No,NA,NA,Yes,Yes,No,17200,0,Kelly 2022,0,40
c53a38b540b2d627223f5b54fe0d65a5,17203,Ebola virus,J,Kelly,Real-time predictions of the 2018–2019 Ebola virus disease outbreak in the Democratic Republic of the Congo using Hawkes point process models,10.1016/j.epidem.2019.100354,Epidemics,2019,28,NA,NA,NA,FALSE,NA,Yes,Yes,Yes,Yes,NA,NA,NA,17203,0,Kelly 2019,1,100
f4e727c0a977d1b4f143361b06a152d9,17206,Ebola virus,John,Kelly,The Impact of Different Types of Violence on Ebola Virus Transmission During the 2018-2020 Outbreak in the Democratic Republic of the Congo,10.1093/infdis/jiaa163,Journal of Infectious Diseases,2020,222,NA,2021,2029,FALSE,NA,Yes,Yes,Yes,Yes,Yes,Yes,No,17206,0,Kelly 2020,0,85.71428571428571
e4b2c56df5267008e946b6d218da00e2,17275,Ebola virus,Lindsey,Kjaldgaard,Virus kinetics and biochemical derangements among children with Ebolavirus disease,10.1016/j.eclinm.2022.101638,Lancet eClinicalMedicine,2022,53,NA,NA,NA,FALSE,For param ID 172; there is a range reported from 13 to 20. But I think this is IQR; since in SI there are age groups in which this delay is greater. Param ID295 is risk factor for onset-admission delay; ID296 is risk factor for length of stay.,Yes,Yes,Yes,Yes,Yes,Yes,Yes,17275,0,Kjaldgaard 2022,0,100
d7352eae9d7cd14c886ff582efa372ff,17279,Ebola virus,Youngsuk,Ko,Ebola virus disease outbreak in Korea: use of a mathematical model and stochastic simulation to estimate risk,10.4178/epih.e2019048,Epidemiology and Health,2019,41,NA,NA,NA,FALSE,NA,Yes,Yes,Yes,Yes,NA,NA,NA,17279,0,Ko 2019,1,100
b7a48518ee8ae42a8e45ab66a642a389,17333,Ebola virus,M,Kraemer,Utilizing general human movement models to predict the spread of emerging infectious diseases in resource poor settings,10.1038/s41598-019-41192-3,Scientific Reports,2019,9,NA,NA,NA,FALSE,NA,Yes,Yes,Yes,Yes,NA,NA,NA,17333,0,Kraemer 2019,1,100
a40000d15178999bd3b4777e897675ac,17334,Ebola virus,Moritz,Kraemer,Dynamics of conflict during the Ebola outbreak in the Democratic Republic of the Congo 2018–2019,10.1186/s12916-020-01574-1,BMC Medicine,2020,18,113,NA,NA,FALSE,NA,No,No,No,No,Yes,No,No,17334,0,Kraemer 2020,0,14.285714285714285
f24cef837e1c03770899c9b606ed87a1,17374,Ebola virus,Mijat,Kustudic,Agent‑based analysis of contagion events according to sourcing locations,10.1038/s41598-021-95336-5,Scientific Reports,2021,11,NA,NA,NA,FALSE,NA,Yes,No,Yes,No,NA,NA,NA,17374,0,Kustudic 2021,1,50
77789c4e8b4d3cf070bfb5f76bd92e2b,17462,Ebola virus,H,Lee,Sexual transmission and the probability of an end of the Ebola virus disease epidemic,10.1016/j.jtbi.2019.03.022,J Theor Biol,2019,471,NA,NA,NA,FALSE,NA,Yes,Yes,Yes,Yes,NA,NA,NA,17462,0,Lee 2019,1,100
753bde501025fa6238d0b849c9328877,17516,Ebola virus,Tony,Li,Metagenomic Next-Generation Sequencing of the 2014 Ebola Virus Disease Outbreak in the Democratic Republic of the Congo,10.1128/JCM.00827-19,Journal of Clinical Microbiology,2019,57,9,NA,NA,FALSE,NA,Yes,Yes,Yes,Yes,Yes,No,No,17516,0,Li 2019,0,71.42857142857143
3ba5ea406dfba023bfbe7250ddcc9991,17533,Ebola virus,Q,Lin,Modeling the 2014-2015 Ebola Virus Disease Outbreaks in Sierra Leone; Guinea; and Liberia with Effect of High- and Low-risk Susceptible Individuals,10.1007/s11538-020-00779-y,Bull Math Biol,2020,82,8,102,NA,FALSE,NA,Yes,No,Yes,No,Yes,No,No,17533,0,Lin 2020,0,42.857142857142854
ed8893d4a7e777ca1d438d04eb3cca33,17599,Ebola virus,Ashley,Lucas,Serology and Behavioral Perspectives on Ebola Virus Disease Among Bushmeat Vendors in Equateur; Democratic Republic of the Congo; After the 2018 Outbreak,10.1093/ofid/ofaa295,Open Forum Infect Dis,2020,7,8,NA,NA,FALSE,Seroprevalence among bushmeat vendors (I labelled this as 'butcher' in the parameter context,Yes,Yes,NA,NA,No,No,No,17599,0,Lucas 2020,0,40
46fd6723ade61df032e9603a20a32eed,17687,Ebola virus,D,Manno,Ebola Virus Glycoprotein IgG Seroprevalence in Community Previously Affected by Ebola; Sierra Leone,10.3201/eid2803.211496,Emerg Infect Dis,2022,28,3,734,738,FALSE,NA,Yes,Yes,NA,NA,Yes,Yes,Yes,17687,0,Manno 2022,0,100
6dfec86bc24666a3642f68b467636f28,17715,Ebola virus,Kaitlyn,Martinez,Spatially-heterogeneous embedded stochastic SEIR models for the 2014-2016 Ebola outbreak in West Africa,10.1016/j.sste.2022.100505,Spatial and Spatio-temporal Epidemiology,2022,41,NA,NA,NA,FALSE,NA,Yes,No,Yes,Yes,Yes,No,No,17715,0,Martinez 2022,0,57.14285714285714
477ee0402399dde9f8119efadc31ab25,17730,Ebola virus,Valentina,Marziano,Estimates of Serial Interval and Reproduction Number of Sudan Virus; Uganda; August–November 2022,10.3201/eid2907.221718,Emerging Infectious Diseases,2023,29,7,1429,1432,FALSE,There are two growth rate parameters; calculated using different methods - exponential and sub-exponential growth. The R0 parameter is a range over different methods (disaggregated by other).,Yes,Yes,Yes,Yes,Yes,Yes,Yes,17730,0,Marziano 2023,0,100
4007815ef84ed499eff52bdd6f573102,17788,Ebola virus,Placide,Mbala-Kingebeni,Medical countermeasures during the 2018 Ebola virus disease outbreak in the North Kivu and Ituri Provinces of the Democratic Republic of the Congo: a rapid genomic assessment,10.1016/s1473-3099(19)30118-5,Lancet Infect Dis,2019,19,6,648,657,FALSE,Evolutionary rates dissaggregated by time; phylogenetic method; and sub-variant; values taken from main text and supplement,Yes,Yes,Yes,Yes,Yes,Yes,Yes,17788,0,Mbala-Kingebeni 2019,0,100
1af36c53e767d835844534887fdf3260,17790,Ebola virus,Placide,Mbala-Kingebeni,2018 Ebola virus disease outbreak in Équateur Province Democratic Republic of the Congo: a retrospective genomic characterisation,10.1016/S1473-3099(19)30124-0,The Lancet Infectious Diseases,2019,19,6,641,647,FALSE,"CFR mentioned in passing; not the main output.  Not extracted. Authors propose a new variant of ebov.
Subsitution rate estimated using either sequences across outbreaks or for a single outbreak; extracted the latter.",Yes,Yes,Yes,Yes,Yes,No,No,17790,0,Mbala-Kingebeni 2019,0,71.42857142857143
885f9b7ebd8492286cd75d03d4fa4c68,17835,Ebola virus,J,Membrebe,Bayesian Inference of Evolutionary Histories under Time-Dependent Substitution Rates,10.1093/molbev/msz094,Mol Biol Evol,2019,36,8,1793,1803,FALSE,Re-analysis of previously published EBOV genomes with a new method. Very limited parameter context is given in this paper; only the number of sequences and a reference where they were first used.,Yes,Yes,Yes,Yes,No,No,No,17835,0,Membrebe 2019,0,57.14285714285714
a7e8012521d9ba7fc969a2a8e6a8dd77,17861,Ebola virus,Alessandro,Miglietta,The Ebola virus disease outbreak in Tonkolili district Sierra Leone: a retrospective analysis of the Viral Haemorrhagic Fever surveillance system July 2014-June 2015,10.1017/s0950268819000177,Epidemiol Infect,2019,147,NA,NA,NA,FALSE,Risk factors of EVD infection are conditional on meeting suspected/probable case definition (ie; EVD negative controls met the suspected/probable case defintion; but tested negative),No,No,Yes,Yes,No,No,No,17861,0,Miglietta 2019,0,28.57142857142857
db0818a41ba19f5c25ce888ab076e748,17881,Ebola virus,Kenji,Mizumoto,Spatial variability in the reproduction number of Ebola virus disease; Democratic Republic of the Congo; January–September 2019,10.2807/1560-7917.Es.2019.24.42.1900588,Euro Surveillance,2019,24,42,NA,NA,FALSE,CI for delay is unspecified width but is called a confidence interval,Yes,Yes,Yes,Yes,Yes,Yes,Yes,17881,0,Mizumoto 2019,0,100
d84e7d847f918f490b72249cf9824663,17939,Ebola virus,Anuj,Mubayi,Analytical Estimation of Data-Motivated Time-Dependent Disease Transmission Rate: An Application to Ebola and Selected Public Health Problems,10.3390/tropicalmed6030141,Tropical Medicine and Infectious Disease,2021,6,141,NA,NA,FALSE,Fitted transmission rate only (beta),Yes,No,No,No,NA,NA,NA,17939,0,Mubayi 2021,1,25
d18dd4f01709aa35452e5d54dcfcfbcf,17946,Ebola virus,Khan,Altaf,Dynamics of Ebola Disease in the Framework of Different Fractional Derivatives,10.3390/e21030303,entropy,2019,21,303,NA,NA,FALSE,NA,Yes,Yes,Yes,Yes,NA,NA,NA,17946,0,Altaf 2019,1,100
e03308c8b41f6e34aa8509636b8ae9c9,17956,Ebola virus,Rachid,Muleia,Multi-population stochastic modeling of Ebola in Sierra Leone: Investigation of spatial heterogeneity,10.1371/journal.pone.0250765,PLOS ONE,2021,16,5,NA,NA,FALSE,Assme transmission rate is constant over a month. Homogenous mixing within each district rather than overall. Has 3 models; extracted the one presented as  main result. Results available by region. extracted parameters fitted to national data.,Yes,Yes,Yes,Yes,Yes,Yes,No,17956,0,Muleia 2021,0,85.71428571428571
a443efe6c6dd1eeaf57bb17ac9a299b9,17981,Ebola virus,Sena,Mursel,Estimation of Ebola’s spillover infection exposure in Sierra Leone based on sociodemographic and economic factors,https://doi.org/10.1371/journal.pone.0271886,PLoS ONE,2022,17,9,NA,NA,FALSE,Looked at risk factors for spillover - was more based on geography than individual level risk factors,Yes,Yes,Yes,NA,Yes,Yes,Yes,17981,0,Mursel 2022,0,100
07cc46f01c94e1b332a182f3affa6bc3,18091,Ebola virus,Antoine,Nkuba-Ndaye,Added Value of an Anti-Ebola Serology for the Management of Clinically Suspected Ebola Virus Disease Patients Discharged as Negative in an Epidemic Context,10.1093/infdis/jiac057,J Infect Dis,2022,226,2,352,356,FALSE,Blood samples re-tested retrospectively from 488 people who were discharged as negative during the outbreak.,Yes,Yes,NA,NA,Yes,Yes,No,18091,0,Nkuba-Ndaye 2022,0,80
8f8ffa4ce31bea8aef269a5d4ba4b1af,18103,Ebola virus,Justus,Nsio,Differential symptomology of possible and confirmed Ebola virus disease infection in the Democratic Republic of the Congo: a retrospective cohort study,10.1016/s1473-3099(22)00584-9,Lancet Infect Dis,2023,23,1,91,102,FALSE,Risk factors for testing positive out of all indiv with possible EVD infection. Sex; age; time of symptom onset to presentation; contact / type of contact; vaccination status; time since vaccination and symptoms. Disaggregated by time to presentation.,Yes,No,NA,NA,Yes,Yes,No,18103,0,Nsio 2023,0,60
484e051b5abfeffdd81da18b9dcbd10e,18104,Ebola virus,Justus,Nsio,2017 Outbreak of Ebola Virus Disease in Northern Democratic Republic of Congo,10.1093/infdis/jiz107,The journal of Infectious Diseases,2019,221,5,701,706,FALSE,outbreak description. A single sequence from this outbreak is made available by the paper.,NA,NA,NA,NA,Yes,Yes,NA,18104,0,Nsio 2019,0,100
