id,covidence_id,pathogen,first_author_first_name,first_author_surname,article_title,doi,journal,year_publication,volume,issue,page_first,page_last,paper_copy_only,notes,qa_m1,qa_m2,qa_a3,qa_a4,qa_d5,qa_d6,qa_d7,covidence_id_text,double_extracted,article_label,model_only,article_qa_score
3fcec020afa4dd79f4e3799404c5b727,30,Ebola virus,Wan,Yang,Transmission network of the 2014-2015 Ebola epidemic in Sierra Leone,10.1098/rsif.2015.0536,Journal of the Royal Society Interface,2015,12,112,NA,NA,FALSE,NA,No,Yes,Yes,Yes,Yes,Yes,Yes,30,1,Yang 2015,0,85.71428571428571
e5de4e8c9d48d85fbcddc27089d528ab,41,Ebola virus,T,Yan,Clinical characteristics of 154 patients suspected of having Ebola virus disease in the Ebola holding center of Jui Government Hospital in Sierra Leone during the 2014 Ebola outbreak,10.1007/s10096-015-2457-z,Eur J Clin Microbiol Infect Dis,2015,34,10,2089,2095,FALSE,Overall number enrolled 154; 108 with confirmed Ebola; 85 successfully followed up. Multivariate analysis showed that age; fever; and viral load were independent predictors of mortality. Disaggregated parameters by outcome (death or recovery).,Yes,Yes,Yes,NA,NA,NA,NA,41,1,Yan 2015,1,100
eb6c62387fa97c769352a7bb387237bb,45,Ebola virus,Dan,Yamin,Epidemiologic characteristics; clinical manifestations; and risk factors of 139 patients with Ebola virus disease in western Sierra Leone,10.1016/j.ajic.2016.04.216,Am J Infect Control,2016,44,11,1285,1290,FALSE,NA,Yes,Yes,Yes,Yes,Yes,Yes,Yes,45,1,Yamin 2016,0,100
3525708414828fd5d9ca08f246b7684c,57,Ebola virus,Zhe,Xu,Epidemiologic characteristics; clinical manifestations; and risk factors of 139 patients with Ebola virus disease in western Sierra Leone,10.1016/j.ajic.2016.04.216,American Journal of Infection Control,2016,44,11,1285,1290,FALSE,NA,Yes,Yes,Yes,Yes,Yes,Yes,NA,57,1,Xu 2016,0,100
303ce94e676cf0a1d1ace01e0a69095f,65,Ebola virus,Zhi-Qiang,Xia,Modeling the transmission dynamics of Ebola virus disease in Liberia,10.1038/srep13857,Scientific Reports,2015,5,NA,13857,NA,FALSE,NA,Yes,Yes,Yes,Yes,Yes,No,Yes,65,1,Xia 2015,0,85.71428571428571
4fc94425009e26eeb0e504fb9e9f08ac,104,Ebola virus,JY,Wong,Assessment of the severity of Ebola virus disease in Sierra Leone in 2014-2015,10.1017/s0950268815003003,Epidemiol Infect,2016,144,7,1473,1481,FALSE,NA,Yes,No,Yes,Yes,NA,NA,NA,104,1,Wong 2016,1,75
0d3ab9694c0ab47d30f7784a03073e80,159,Ebola virus,Anuwat,Wiratsudakul,A one-year effective reproduction number of the 2014–2015 Ebola outbreaks in the widespread West African countries and quantitative evaluation of air travel restriction measure,10.1016/j.tmaid.2016.06.011,Travel Medicine and Infectious Disease,2016,14,5,481,488,FALSE,NA,Yes,Yes,Yes,Yes,Yes,Yes,Yes,159,1,Wiratsudakul 2016,0,100
542079f47e4f6dc9aa081e1057534e28,163,Ebola virus,Kevin,Wing,Surviving Ebola: A historical cohort study of Ebola mortality and survival in Sierra Leone 2014-2015,10.1371/journal.pone.0209655,PLoS One,2018,13,12,209655,NA,FALSE,NA,Yes,Yes,Yes,Yes,Yes,Yes,No,163,1,Wing 2018,0,85.71428571428571
d34ce31290d5cdb2932ce7234a0db91b,199,Ebola virus,Shannon L.M.,Whitmer,Active Ebola Virus Replication and Heterogeneous Evolutionary Rates in EVD Survivors,10.1016/j.celrep.2018.01.008,Cell Reports,2018,22,5,1159,1168,FALSE,NA,Yes,Yes,Yes,Yes,NA,NA,NA,199,1,Whitmer 2018,1,100
f100b2302fc4be162f4416326797e5c7,206,Ebola virus,Richard A,White,Projected treatment capacity needs in sierra leone,10.1371/currents.outbreaks.3c3477556808e44cf41d2511b21dc29f,PLoS Currents,2015,7,NA,NA,NA,FALSE,NA,Yes,No,Yes,No,Yes,Yes,No,206,1,White 2015,0,57.14285714285714
cc9dc1da5446d1b8576f8ea6c70616a4,241,Ebola virus,Joseph,Wamala,Ebola hemorrhagic fever associated with novel virus strain; Uganda; 2007-2008,10.3201/eid1607.091525,Emerg Infect Dis,2010,16,7,1087,1092,FALSE,no Cis on CFRs,Yes,No,NA,NA,Yes,Yes,Yes,241,1,Wamala 2010,0,80
5a9dcf44529848f52569aad3353cca01,291,Ebola virus,Erik,Volz,Phylodynamic analysis of ebola virus in the 2014 sierra leone epidemic,10.1371/currents.outbreaks.6f7025f1271821d4c815385b08f5f80e,PLoS Currents,2014,6,NA,NA,NA,FALSE,Presents 4 values of R0 so only extract range.  Has uncertanity but don't extract as no central value selected,Yes,Yes,Yes,Yes,Yes,Yes,No,291,1,Volz 2014,0,85.71428571428571
0d18307d346b239ddeb93e49ee8ad29c,315,Ebola virus,John E.,Vinson,The potential for sexual transmission to compromise control of Ebola virus outbreaks,10.1098/rsbl.2015.1079,Biology Letters,2016,12,6,NA,NA,FALSE,NA,Yes,Yes,Yes,No,NA,NA,NA,315,1,Vinson 2016,1,75
aa272b419e13bc7a33f9098207acb77e,404,Ebola virus,Gul,Zaman,"Optimal treatment of an SIR epidemic model with time delay
Optimal treatment of an SIR epidemic model with time delay
Optimal treatment of an SIR epidemic model with time delay
Optimal treatment of an SIR epidemic model with time delay",10.1016/j.biosystems.2009.05.006,BioSystems,2009,98,NA,43,50,FALSE,SIR with delay,Yes,Yes,Yes,Yes,NA,NA,NA,404,1,Zaman 2009,1,100
b884aa2380d205eb1ef498accd44e413,411,Ebola virus,Joseph W.,Zabinski,"A Bayesian Belief Network Model Assessing the Risk
to Wastewater Workers of Contracting Ebola Virus
Disease During an Outbreak",10.1111/risa.12827,Risk Analysis,2018,38,2,376,391,FALSE,Bayesian Belief Network Model,Yes,Yes,Yes,Yes,NA,NA,NA,411,1,Zabinski 2018,1,100
e876737983c7dd1d25bc12f201c8e07a,442,Ebola virus,Cécile,Viboud,"A generalized-growth model to characterize the early ascending
phase of infectious disease outbreaks",10.1016/j.epidem.2016.01.002.,Epidemics,2016,15,NA,27,37,FALSE,NA,Yes,No,Yes,Yes,NA,NA,NA,442,1,Viboud 2016,1,75
fb75e3cf8f2726b4ecc2293c644be32e,448,Ebola virus,Marie-Astrid,Vernet,Clinical; virological; and biological parameters associated with outcomes of Ebola virus infection in Macenta; Guinea,10.1172/jci.insight.88864,JCI Insight,2017,2,6,NA,NA,FALSE,Viral load at admission was significantly higher in fatal cases than survivors.,Yes,Yes,Yes,Yes,Yes,No,No,448,1,Vernet 2017,0,71.42857142857143
bcc3cad1392427d2eac6339c6dbca885,454,Ebola virus,S,Venkatramanan,Using data-driven agent-based models for forecasting emerging infectious diseases,10.1016/j.epidem.2017.02.010,Epidemics,2018,22,NA,43,49,FALSE,Estimates of Reff included in supplementary but are based on simulated data from RAPIDD Ebola Forecasting Challenge so not extracted.,No,Yes,No,No,NA,NA,NA,454,1,Venkatramanan 2018,1,25
f37077b206fc03d11c5dcdaf869a9e42,505,Ebola virus,Linda,Valeri,Predicting Subnational Ebola Virus Disease Epidemic Dynamics from Sociodemographic Indicators,10.1371/journal.pone.0163544,PLOS one,2016,11,10,163544,NA,FALSE,NA,Yes,No,No,No,Yes,Yes,No,505,1,Valeri 2016,0,42.857142857142854
0e6bc65c8a1b7a39d7ab50f6451d4409,506,Ebola virus,C.,Valencia,Network visualization for outbreak response: Mapping the Ebola Virus Disease (EVD) chains of transmission in N'Zerekore; Guinea,10.1016/j.jinf.2016.09.012,Journal of Infection,2017,74,NA,294,301,FALSE,NA,No,No,NA,NA,Yes,Yes,No,506,1,Valencia 2017,0,40
fe453c4208e5075ec017c017a09b1829,507,Ebola virus,L. D.,Valdez,Predicting the extinction of Ebola spreading in Liberia due to mitigation strategies,10.1038/srep12172,Scientific Reports,2015,5,12172,NA,NA,FALSE,NA,No,Yes,Yes,Yes,Yes,No,No,507,1,Valdez 2015,0,57.14285714285714
dbf72a66bdf4fcdd81ae089fe550a279,509,Ebola virus,Timothy,Uyeki,Clinical Management of Ebola Virus Disease in the United States and Europe,10.1056/NEJMoa1504874,N Engl J Med,2016,374,7,636,646,FALSE,Symp to hosp: 4 days (medically evacuated patients and patients with locally acquired cases); 2 days (imported cases). Symp to diag: 3 days (1-9). Symp to neg RTPCR (viremia): 17.5 (5-27). Symp to IgM: 10 (6-11). Symp to IgG: 11 (9-11),Yes,Yes,NA,NA,Yes,Yes,No,509,1,Uyeki 2016,0,80
286132aadf462c53c4975323ade940d3,525,Ebola virus,Florian,Uekermann,Exploring the contribution of exposure heterogeneity to the cessation of the 2014 Ebola epidemic,10.1371/journal.pone.0210638,PLOS One,2019,14,2,NA,NA,FALSE,NA,No,No,Yes,No,Yes,No,No,525,1,Uekermann 2019,0,28.57142857142857
4d2689c90e6d3dfd389236bc1181e8e0,547,Ebola virus,Ashleigh R.,Tuitea,"The IDEA model: A single equation approach to the Ebola forecasting
challenge",10.1016/j.epidem.2016.09.001,Epidemics,2018,22,NA,71,77,FALSE,incidence decay with exponential adjustment (IDEA) model,Yes,Yes,Yes,Yes,NA,NA,NA,547,1,Tuitea 2018,1,100
c639f4284d7558403d5c16af5f561abb,562,Ebola virus,Georgios,Theocharopoulos,Ebola management centre proximity associated with reduced delays of healthcare of Ebola Virus Disease (EVD) patients; Tonkolili; Sierra Leone; 2014–15,10.1371/journal.pone.0176692,PLoS One,2017,12,5,NA,NA,FALSE,Cases were residents of Tonkolili district who presented to the MSF EMCs between 12 September 2014 and 23 February 2015 and were confirmed as having EVD by positive Ebola polymerase chain reaction (PCR) test of blood or saliva.,Yes,No,NA,NA,Yes,Yes,No,562,1,Theocharopoulos 2017,0,60
68acd49010ce6fd71c095693fce5f854,590,Ebola virus,B.P.,Taylor,Stochasticity and the limits to confidence when estimating R0 of Ebola and other emerging infectious diseases,10.1016/j.jtbi.2016.08.016,Journal of Theoretical Biology,2016,408,NA,145,154,FALSE,"Not clear what period of case data they used.
Method described as 'hybrid deterministic stochastic'.",Yes,Yes,Yes,Yes,No,Yes,No,590,1,Taylor 2016,0,71.42857142857143
6881ca24ae61d5dfdf6272c3733f18fc,654,Ebola virus,Yoshiyuki,Suzuki,The Origin and Evolution of Ebola and Marburg Viruses,NA,Molecular Biology and Evolution,1997,14,8,800,806,TRUE,They reported strains from the accession numbers; not the 4 main strains of Ebola.,Yes,No,No,No,Yes,Yes,No,654,1,Suzuki 1997,0,42.857142857142854
049eb5e93016f28ce1842e7f08a4d6f7,662,Ebola virus,Thomas A.,Weppelmann,Determinants of patient survival during the 2014 Ebola Virus Disease outbreak in Bong County; Liberia,10.1186/s41256-016-0005-8,Global Health Research and Policy,2016,1,5,NA,NA,FALSE,NA,Yes,Yes,Yes,Yes,NA,NA,NA,662,1,Weppelmann 2016,1,100
85f56ac7fc35d2274b0e6c6dd3893c54,676,Ebola virus,Joshua S.,Weitz,Modeling Post-death Transmission of Ebola: Challenges for Inference and Opportunities for Control,10.1038/srep08751,Scientific Reports,2015,5,8751,NA,NA,FALSE,NA,No,Yes,Yes,Yes,NA,NA,NA,676,1,Weitz 2015,1,75
a54250d76ce4c96cc9cec53db339c9c2,700,Ebola virus,GF,Webb,A model of the Ebola epidemics in West Africa incorporating age of infection,10.1080/17513758.2015.1090632,J Biol Dyn,2016,10,NA,18,30,FALSE,NA,Yes,Yes,Yes,Yes,No,No,No,700,1,Webb 2016,0,57.14285714285714
aab3a5f4f8dfb7ae44024ea61e504b3e,701,Ebola virus,G,Webb,A model of the 2014 ebola epidemic in west Africa with contact tracing,10.1371/currents.outbreaks.846b2a31ef37018b7d1126a9c8adf22a,PLOS currents,2015,7,NA,NA,NA,FALSE,NA,Yes,Yes,Yes,Yes,Yes,No,No,701,1,Webb 2015,0,71.42857142857143
aee61aae8853d88478b2e720659097b1,754,Ebola virus,Xiang-Sheng,Wang,Ebola outbreak in West Africa: real-time estimation and multiple-wave prediction,10.3934/mbe.2015.12.1055,Mathematical Biosciences and Engineering,2015,12,5,1055,1063,FALSE,NA,Yes,No,Yes,Yes,No,No,No,754,1,Wang 2015,0,42.857142857142854
e276e015ebed7a843c39ac62eb00f39e,757,Ebola virus,Xiaojing,Wang,Evaluations of Interventions Using Mathematical Models with Exponential and Non-exponential Distributions for Disease Stages: The Case of Ebola,10.1007/s11538-017-0324-z,Bulletin of Mathematical Biology,2017,79,9,2149,2173,FALSE,Mathematical Model Only,Yes,Yes,Yes,Yes,NA,NA,NA,757,1,Wang 2017,1,100
90af517679e991e9a8b9485d599ef086,847,Ebola virus,Tasha,Stehling-Ariza,The impact of active surveillance and health education on an Ebola virus disease cluster -- Kono District; Sierra Leone; 2014-2015,10.1186/s12879-016-1941-0,BMC Infectious Diseases,2016,16,611,NA,NA,FALSE,NA,Yes,Yes,Yes,Yes,Yes,Yes,Yes,847,1,Stehling-Ariza 2016,0,100
30b6feb254d3820d17a5d69feb04d77d,865,Ebola virus,Tanja,Stadler,Insights into the early epidemic spread of ebola in sierra leone provided by viral sequence data,10.1371/currents.outbreaks.02bc6d927ecee7bbd33532ec8ba6a25f,PLoS Currents,2014,6,NA,NA,NA,FALSE,"Authors calculated outputs with 5 different models; each with either fixed R0 or varied; the outputs of the model they deemed to be the 'best' are reported here. The rest in tables 1-2.
Authors have made their oftware methods available on github.",Yes,Yes,Yes,Yes,Yes,Yes,Yes,865,1,Stadler 2014,0,100
da6b9ad32d7405692bf9c817b62f214a,885,Ebola virus,Constantinos,Siettos,Forecasting and control policy assessment for the Ebola virus disease (EVD) epidemic in Sierra Leone using small-world networked model simulations,10.1136/bmjopen-2015-008649,BMJ Open,2016,6,1,8649,NA,FALSE,fit to cumulative cases,No,No,Yes,No,Yes,Yes,No,885,1,Siettos 2016,0,42.857142857142854
1076581ed2e1053c84d0ff18aa088425,886,Ebola virus,Constantinos,Siettos,Modeling the 2014 Ebola Virus Epidemic – Agent-Based Simulations; Temporal Analysis and Future Predictions for Liberia and Sierra Leone,10.1371/currents.outbreaks.8d5984114855fc425e699e1a18cdc6c9,PLoS Curr,2015,7,NA,NA,NA,FALSE,NA,Yes,No,No,No,No,No,No,886,0,Siettos 2015,0,14.285714285714285
e4304ec72e1d2fef9fc300e95f48fd2c,904,Ebola virus,James,Shultz,Distinguishing epidemiological features of the 2013–2016 West Africa Ebola virus disease outbreak,10.1080/21665044.2016.1228326,Disaster Health,2016,3,3,78,88,FALSE,CFR combined for 24 EVD outbreaks 1976-2014. Said no for clearly described and reproducible because not clear where the outbreak data on cases/deaths/recovered for old outbreaks came from.,Yes,Yes,Yes,No,No,No,No,904,0,Shultz 2016,0,42.857142857142854
167371bdff6b92adf24a4bdd10617080,944,Ebola virus,Mingwang,Shen,Modeling the effect of comprehensive interventions on Ebola virus transmission,10.1038/srep15818,Sci Rep,2015,5,NA,NA,NA,FALSE,NA,Yes,Yes,Yes,Yes,Yes,No,No,944,0,Shen 2015,0,71.42857142857143
8a9f0d7912a477c63e351732dd0ed734,977,Ebola virus,Jeffrey,Shaman,Inference and Forecast of the Current West African Ebola Outbreak in Guinea; Sierra Leone and Liberia,10.1371/currents.outbreaks.3408774290b1a0f2dd7cae877c8b8ff6,PLoS Curr,2014,6,NA,NA,NA,FALSE,NA,Yes,Yes,Yes,Yes,NA,NA,NA,977,0,Shaman 2014,1,100
3c7b54faf99b27ebbe803395e37fdba3,1012,Ebola virus,Sherry,Towers,Temporal variations in the effective reproduction number of the 2014 west Africa ebola outbreak,10.1371/currents.outbreaks.9e4c4294ec8ce1adad283172b16bc908,PLoS Curr,2014,6,NA,NA,NA,FALSE,Considered different incubation and infectious periods. Analysed data separately and together. Don't say whether Rt is mean/median. Contradicting end dates. Don't describe SEIR model used!,No,No,No,No,No,No,No,1012,0,Towers 2014,0,0
ff5e220d69ee800662b0f3000d28889f,1015,Ebola virus,Damon J.A.,Toth,"Estimates of Outbreak Risk
from New Introductions of
Ebola with Immediate and
Delayed Transmission Control",10.3201/eid2108.150170,Emerging Infectious Diseases,2015,21,8,1402,1408,FALSE,These aren't really values of R0 for the whole outbreak.  Just certain scenrios,Yes,Yes,Yes,Yes,Yes,No,No,1015,0,Toth 2015,0,71.42857142857143
346f2495466076f0392b926caaa1d1ea,1026,Ebola virus,Yi-Gang,Tong,Genetic diversity and evolutionary dynamics of Ebola virus in Sierra Leone,10.1038/nature14490,Nature,2015,542,NA,93,96,FALSE,NA,Yes,Yes,No,No,Yes,No,No,1026,0,Tong 2015,0,42.857142857142854
85317233d61d9e98f0ceff525286ce12,1030,Ebola virus,Oyewale,Tomori,"Serologic Survey among Hospital and Health Center Workers during the Ebola
Hemorrhagic Fever Outbreak in Kikwit; Democratic Republic of the Congo;
1995",10.1086/514307,The Journal of Infectious Diseases,1991,179,NA,NA,NA,FALSE,Supplement 1 of journal S98-101,Yes,Yes,Yes,Yes,Yes,Yes,Yes,1030,1,Tomori 1991,0,100
8f32d05731baae4b4ea467807da74409,1044,Ebola virus,JWS,Timothy,Early transmission and case fatality of Ebola virus at the index site of the 2013-16 west African Ebola outbreak: a cross-sectional seroprevalence survey,10.1016/s1473-3099(18)30791-6,Lancet Infect Dis,2019,NA,NA,NA,NA,FALSE,NA,Yes,Yes,Yes,Yes,NA,NA,NA,1044,1,Timothy 2019,0,100
fc7f944f3cba3e7f71ff2ee78d0f787b,1053,Ebola virus,Amanda,Tiffany,Estimating the number of secondary Ebola cases resulting from an unsafe burial and risk factors for transmission during the West Africa Ebola epidemic,10.1371/journal.pntd.0005491,PLoS Neglected Tropical Diseases,2017,11,6,NA,NA,FALSE,"R is secondary EVD cases associated with unsafe burials.
QA is for overall.  Some parameters methods are better than others.",Yes,No,No,No,Yes,No,No,1053,0,Tiffany 2017,0,28.57142857142857
9124638ef2eaf679f1fa1201f5e37ca6,1068,Ebola virus,"Narges
Narges",Shahtori,Quantifying the impact of early-stage contact tracing on controlling Ebola diffusion,10.3934/mbe.2018053,Mathematical Biosciences and Engineering,2018,15,5,1165,1180,FALSE,NA,No,Yes,Yes,Yes,NA,NA,NA,1068,0,Shahtori 2018,1,75
fef8bcbc8de52847f561152c4f0a08c5,1071,Ebola virus,Tejshri,Shah,"Inpatient signs and symptoms and factors associated with death in children aged 5 years and younger admitted to two Ebola management centres in Sierra Leone; 2014:
a retrospective cohort study",10.1016/s2214-109x(16)30097-3,Lancet Global Health,2016,4,7,NA,NA,FALSE,NA,Yes,Yes,Yes,Yes,Yes,Yes,Yes,1071,0,Shah 2016,0,100
a5c39cde4d02c78aabcd836dce6f27a7,1086,Ebola virus,Mikiko,Senga,"Factors Underlying Ebola Virus Infection Among Health
Workers; Kenema; Sierra Leone; 2014–2015",10.1093/cid/ciw327,Clinical Infectious Diseases,2016,63,4,454,459,FALSE,There were 600 cases.  92 were health care workers . Didn't do the maths to work out the number of non-health care worker as wasn't reported.,Yes,Yes,Yes,Yes,Yes,Yes,No,1086,0,Senga 2016,0,85.71428571428571
28996c4cd90020fbe0d8064ee8317b53,1157,Ebola virus,J.S.,Schieffelin,"Clinical Illness and Outcomes in Patients
with Ebola in Sierra Leone",10.1056/NEJMoa1411680,New England Journal of Medicine,2014,371,NA,2092,2100,FALSE,Data was disaggregated by outcome.  Both outcomes extracted separately,Yes,Yes,NA,NA,Yes,Yes,Yes,1157,0,Schieffelin 2014,0,100
d3a11ceb5b78982bd75e65a295413dd2,1170,Ebola virus,Samuel, Scarpino,Epidemiological and viral genomic sequence analysis of the 2014 ebola outbreak reveals clustered transmission,10.1093/cid/ciu1131,Clinical Infectious Diseases,2015,60,7,1079,1082,FALSE,NA,Yes,No,Yes,Yes,No,No,No,1170,0, Scarpino 2015,0,42.857142857142854
a73b50ba6e961ed9986090c6d2d36de8,1201,Ebola virus,Enqiang,Qin,Clinical Features of Patients With Ebola Virus Disease in Sierra Leone,10.1093/cid/civ319,Clinical Infectious Diseases,2015,61,4,491,495,FALSE,Mean value for duration from onset symptom to clinic visit extracted; but median also available in paper ; also disaggregated by patient outcome.,Yes,No,No,No,Yes,Yes,No,1201,0,Qin 2015,0,42.857142857142854
d09f129b1e1967ddb69987abff1906eb,1253,Ebola virus,Joan,Ponce,Assessing the effects of modeling the spectrum of clinical symptoms on the dynamics and control of Ebola,10.1016/j.jtbi.2019.01.013,Journal of Theoretical Biology,2019,467,NA,111,122,FALSE,NA,Yes,No,Yes,Yes,No,No,No,1253,0,Ponce 2019,0,42.857142857142854
17f9e94e46af08eeebab90eab3f510cf,1323,Ebola virus,M., Sofonea,Can Ebola virus evolve to be less virulent in humans?,10.1111/jeb.13229,Journal of Evolutionary Biology,2018,31,3,382,392,FALSE,NA,Yes,Yes,Yes,Yes,Yes,Yes,No,1323,0, Sofonea 2018,0,85.71428571428571
c1b4278ecf64e01e2e8d1c861ea25ac7,1367,Ebola virus,Alexandra,Smirnova,Forecasting Epidemics Through Nonparametric Estimation of Time-Dependent Transmission Rates Using the SEIR Model,10.1007/s11538-017-0284-3,Bulletin of Mathematical Biology,2017,NA,NA,NA,NA,FALSE,No parameter values extracted; only model.,Yes,Yes,NA,NA,NA,NA,NA,1367,0,Smirnova 2017,1,100
cffd126042f8941031eca14164a394e4,1368,Ebola virus,Manuel,De la Sen,A primer on stable parameter estimation and forecasting in epidemiology by a problem-oriented regularized least squares algorithm,10.1016/j.idm.2017.05.004,Infectious Disease Modelling,2017,2,2,268,275,FALSE,NA,Yes,Yes,NA,NA,NA,NA,NA,1368,0,De la Sen 2017,1,100
10001f46b11d79386a37fce14e2f08b0,1375,Ebola virus,Laura, Skrip,Characterizing risk of Ebola transmission based on frequency and type of case - contact exposures,10.1098/rstb.2016.0301,Philosophical Transactions  of the Royal Society London B Biological Sciences,2017,372,1721,NA,NA,FALSE,Unadjusted risk factors also available but the conclusion on which factors are significant and which aren't isn't impacted by this.,Yes,Yes,Yes,Yes,Yes,Yes,No,1375,0, Skrip 2017,0,85.71428571428571
75998b2a00352be07cf864b3036246e7,1385,Ebola virus,Daouda,Sissoko,Persistance and clearance of Ebola virus RNA from seminal fluid of Ebola virus disease survivors: a longitudinal analysis and modelling study,10.1016/S2214-109X(16)30243-1,Lancet Global Health,2017,5,NA,NA,NA,FALSE,NA,Yes,Yes,Yes,Yes,Yes,Yes,No,1385,0,Sissoko 2017,0,85.71428571428571
b0c1397246cb81bfd8e2eb4a82c60046,1407,Ebola virus,Etienne,Simon-Loriere,Distinct lineages of Ebola virus in Guinea during the 2014 West African epidemic,10.1038/nature14612,Nature,2015,524,NA,102,104,FALSE,NA,Yes,Yes,Yes,Yes,Yes,No,No,1407,0,Simon-Loriere 2015,0,71.42857142857143
3f047aec31feca79699e18d97f213da1,1435,Ebola virus,Alessandro,Pini,Field investigation with real-time virus genetic characterisation support of a cluster of Ebola virus disease cases in Dubreka; Guinea; April to June 2015,10.2807/1560-7917.ES.2018.23.12.17-00140,Surveillance and Outbreak Report,2018,23,12,17,40,FALSE,NA,Yes,No,Yes,Yes,No,Yes,No,1435,0,Pini 2018,0,57.14285714285714
e89dff998856c9eb86a1baad291a8fa3,1471,Ebola virus,W. B. P.,Pettey,Constructing Ebola transmission chains from West Africa and estimating model parameters using internet sources,10.1017/S0950268817000760,Epidemiology and Infection,2017,145,NA,1993,2002,FALSE,Use of novel data streams - public web pages such as newspapers; blogs; etc.,No,Yes,Yes,Yes,Yes,Yes,No,1471,0,Pettey 2017,0,71.42857142857143
6083e596e88cc8d5790fa8c1e9954763,1483,Ebola virus,Jillian L.,Peters,Environmental temperature and case fatality of patients with Ebola virus disease in Sierra Leon and Liberia; 2014-2015: a retrospective cohort study,10.1111/tmi.13166,Tropical Medicine and International Health,2019,24,1,23,30,FALSE,NA,Yes,Yes,Yes,Yes,Yes,Yes,No,1483,0,Peters 2019,0,85.71428571428571
7000c401d4138beb8ee1481c45895558,1510,Ebola virus,Bruce,Pell,Using phenomenological models for forecasting the 2015 Ebola challenge,10.1016/j.epidem.2016.11.002,Epidemics,2016,22,2018,62,70,FALSE,Generation time estimates are disaggregated by scenario.,Yes,Yes,Yes,Yes,NA,NA,NA,1510,0,Pell 2016,1,100
1ae21a5eeef620ee9a5a4a011a75dab4,1543,Ebola virus,Garrett T.,Nieddu,Extinction pathways and outbreak vulnerability in a stochastic Ebola model,10.1098/rsif.2016.0847,Journal of Royal Soceity Interface,2017,14,20160847,NA,NA,FALSE,NA,Yes,Yes,Yes,Yes,NA,NA,NA,1543,0,Nieddu 2017,1,100
9e1de28b5d061538d597c57507461fe8,1552,Ebola virus,G,Ngwa,A Mathematical Model with Quarantine States for the Dynamics of Ebola Virus Disease in Human Populations,10.1155/2016/9352725,Computational and Mathematical Methods in Medicine,2016,NA,NA,NA,NA,FALSE,NA,Yes,No,Yes,Yes,NA,NA,NA,1552,0,Ngwa 2016,1,75
2d2241516283dbb95a5f0ee18a4186b0,1561,Ebola virus,S,Ng,Association between temperature; humidity and ebolavirus disease outbreaks in Africa; 1976 to 2014,10.2807/1560-7917.ES2014.19.35.20892,Eurosurveillance,2014,19,35,NA,NA,FALSE,Paper describes environmental factors (temperature/humidity) as risk factors to potential Ebola outbreak,No,Yes,Yes,Yes,Yes,Yes,Yes,1561,0,Ng 2014,0,85.71428571428571
33b2fb6913265d3a8c8e1e6ddd635b48,1586,Ebola virus,R,Ndambi,Epidemiologic and clinical aspects of the Ebola virus epidemic in Mosango; Democratic Republic of the Congo; 1995,10.1086/514297,Journal of Infectious Diseases,1999,179,1,8,10,FALSE,NA,NA,NA,NA,NA,Yes,NA,NA,1586,0,Ndambi 1999,0,100
8c43a8ea4a991bc1c851b345afd759d3,1628,Ebola virus,C,Nanclares,Ebola Virus Disease; Democratic Republic of the Congo; 2014,10.3201/eid2209.160354,Emerging Infectious Diseases,2016,22,9,1579,1586,FALSE,NA,NA,No,Yes,NA,Yes,Yes,Yes,1628,0,Nanclares 2016,0,80
634677edf39c63496a72f4a0410d1d16,1636,Ebola virus,E,Saulnier,Inferring epidemiological parameters from phylogenies using regression-ABC: A comparative study,10.1371/journal.pcbi.1005416,PLOS Computational Biology,2017,13,3,NA,NA,FALSE,NA,No,Yes,Yes,Yes,No,Yes,Yes,1636,0,Saulnier 2017,0,71.42857142857143
b347e8da74ac2e0a59055dd7c0908967,1653,Ebola virus,Caitlin,Rivers,Modeling the Impact of Interventions on an Epidemic of Ebola in Sierra Leone and Liberia,10.1371/currents.outbreaks.4d41fe5d6c05e9df30ddce33c66d084c,PLOS Currents,2014,6,NA,NA,NA,FALSE,NA,Yes,No,No,No,Yes,Yes,No,1653,0,Rivers 2014,0,42.857142857142854
b8f900696fd5099c5932ad4a39234a2d,1679,Ebola virus,Adriana,Rico,Epidemiology of Epidemic Ebola Virus Disease in Conakry and Surrounding Prefectures; Guinea; 2014–2015,10.3201/eid2202.151304,Emerging Infectious Diseases,2016,22,2,178,183,FALSE,NA,Yes,Yes,NA,NA,Yes,Yes,No,1679,0,Rico 2016,0,80
e7a4fbd255a4643ba40d21b8710cb8ee,1686,Ebola virus,Eugene,Richardson,Minimally Symptomatic Infection in an Ebola `Hotspot': A Cross-Sectional Serosurvey,10.1371/journal.pntd.0005087,PLOS Neglected Tropical Diseases,2016,10,11,NA,NA,FALSE,NA,Yes,Yes,NA,NA,Yes,Yes,No,1686,0,Richardson 2016,0,80
4efc985e19f4c10227aa4b6364d47aa0,1749,Ebola virus,Mary,Reichler,Household Transmission of Ebola Virus: Risks and Preventive Factors; Freetown; Sierra Leone; 2015,10.1093/infdis/jiy204,The Journal of Infectious Diseases,2018,218,5,757,767,FALSE,The attack rate extracted here is a secondary attack rate (SAR). The risk factors for infection here are the risk factors for the SAR; while the 'other' risk factors are for the household transmission rate.,Yes,Yes,NA,NA,Yes,Yes,No,1749,0,Reichler 2018,0,80
