id,covidence_id,pathogen,first_author_first_name,first_author_surname,article_title,doi,journal,year_publication,volume,issue,page_first,page_last,paper_copy_only,notes,qa_m1,qa_m2,qa_a3,qa_a4,qa_d5,qa_d6,qa_d7,covidence_id_text,double_extracted,article_label,model_only,article_qa_score
7f8db90a9bb68c44dfd26a23cceda1f2,7283,Ebola virus,Berge,Tsanou,Assessing the impact of the environmental contamination on the transmission of Ebola virus disease (EVD),10.1007/s12190-016-1033-8,Journal of Applied Mathematics and Computing,2017,55,NA,205,243,FALSE,NA,Yes,No,Yes,No,NA,NA,NA,7283,0,Tsanou 2017,1,50
a8d3da406391d31cd5e4eef9c624cf6f,7345,Ebola virus,Oyewale,Tomori,"Serologic Survey among Hospital and Health Center Workers during the Ebola
Hemorrhagic Fever Outbreak in Kikwit; Democratic Republic of the Congo; 1995",10.1086/514307,The Journal of Infectious Diseases,1999,179,NA,98,101,FALSE,NA,Yes,Yes,NA,NA,Yes,No,No,7345,0,Tomori 1999,0,60
83302acb7e0e4563daac3a742cad54c4,7899,Ebola virus,Abhinav,Tandon,Modeling the impact of migrated population on human-to-human transmission of Ebola virus disease,10.1142/S1793962318500083,International Journal of Modeling; Simulation; and Scientific Computing,2018,9,1,NA,NA,TRUE,NA,Yes,No,Yes,No,NA,NA,NA,7899,0,Tandon 2018,1,50
b9a14242782d71519765da54e70bd249,7942,Ebola virus,Muhammad,Tahir,"Ebola virus epidemic disease its modeling and
stability analysis required abstain strategies",10.1080/23312025.2018.1488511,Cogent Biology,2018,4,1,NA,NA,FALSE,NA,Yes,No,Yes,No,NA,NA,NA,7942,0,Tahir 2018,1,50
2bee98efa114d97dcafb5209c344c83f,8131,Ebola virus,Parimita,Roy,"Spatiotemporal Transmission Dynamics Of Recent Ebola Outbreak In Sierra Leone; West Africa: Impact Of Control Measures
OF RECENTEBOLAOUTBREAKINSIERRALEONE;
WEST AFRICA: MPACT OF CONTROL MEASURES",10.1142/S0218339017500176,Journal of Biological Systems,2017,5,3,369,397,TRUE,NA,No,No,Yes,Yes,NA,NA,NA,8131,0,Roy 2017,1,50
67da962d54488f8dcfc0d023270ad6c7,8659,Ebola virus,S,Salah,A NEGATIVE HUMAN SEROSURVEY OF HAEMORRHAGIC FEVER VIRUSES IN DJIBOUTI,10.1016/s0769-2617(88)80079-0,Annales De L'Institut Pasteur-Virology,1988,139,4,439,442,FALSE,NA,No,No,NA,NA,No,No,No,8659,0,Salah 1988,0,0
ca8e8a5faf4042ebafd849b6f5fb3ad0,8691,Ebola virus,Ramses,Sadek,Ebola Hemorrhagic Fever; Democratic Republic of the Congo; 1995: Determinants of Survival,10.1086/514311,Journal of Infectious Diseases,1999,179,NA,24,27,FALSE,NA,Yes,Yes,NA,NA,Yes,No,No,8691,0,Sadek 1999,0,60
7130b4f66a9aa8c91319b4e8d093384e,8709,Ebola virus,Lucia,Russo,"Accessing the Impact of the Contact Transmission Network
Topology in Ebola Virus Epidemic in Liberia: a Comparative Study using Agent-Based Simulations",10.3303/CET1653040,CHEMICAL ENGINEERING TRANSACTIONS,2016,53,NA,235,240,FALSE,NA,Yes,No,Yes,No,Yes,No,No,8709,0,Russo 2016,0,42.857142857142854
58f10129cdf7a4f42ea7833da594d3da,8731,Ebola virus,Amira,Rachah,ANALYSIS; SIMULATION AND OPTIMAL CONTROL OF A SEIR MODEL FOR EBOLA VIRUS WITH DEMOGRAPHIC EFFECTS,10.1501/Commua1_0000000841,Communications Faculty of Sciences University of Ankara-Series A1 Mathematics and Statistics,2018,67,1,179,197,FALSE,NA,Yes,No,Yes,No,Yes,No,No,8731,0,Rachah 2018,0,42.857142857142854
d00318f628a70063eb3e734d0650e1af,8732,Ebola virus,Amira,Rachah,Predicting and controlling the Ebola infection,10.1002/mma.3841,Mathematical Methods in Applied Sciences,2017,40,NA,6155,6164,FALSE,NA,Yes,No,Yes,No,NA,NA,NA,8732,0,Rachah 2017,1,50
80f8340f60371505634ede1e8bd1fb9a,8733,Ebola virus,Amira,Rachah,Dynamics and Optimal Control of Ebola Transmission,10.1007/s11786-016-0268-y,Mathematics in Computer Science,2016,10,NA,331,342,FALSE,NA,Yes,No,Yes,No,NA,NA,NA,8733,0,Rachah 2016,1,50
fff336966c4bfba7e4a3d09a0cbc8dad,8734,Ebola virus,Amira,Rachah,OPTIMAL CONTROL STRATEGIES FOR THE SPREAD OF EBOLA IN WEST AFRICA,NA,Journal of Mathematical Analysis,2016,7,1,102,114,FALSE,NA,Yes,No,Yes,No,NA,NA,NA,8734,0,Rachah 2016,1,50
7f263d4682a05d60620c41308f20f02b,8735,Ebola virus,Amira,Rachah,Mathematical Modelling; Simulation; and Optimal Control of the 2014 Ebola Outbreak in West Africa,10.1155/2015/842792,Discrete Dynamics in Nature and Society,2015,NA,NA,NA,NA,FALSE,NA,No,No,No,No,NA,NA,NA,8735,0,Rachah 2015,1,0
ffd0186006dc2aab310d2ecf5cd1624e,8800,Ebola virus,Erik,Pruyt,Ebola in West Africa: Model-Based Exploration of Social Psychological Effects and Interventions,10.1002/sres.2329,Systems Research and Behavioral Science,2015,32,NA,2,14,FALSE,NA,Yes,No,Yes,Yes,Yes,Yes,No,8800,0,Pruyt 2015,0,71.42857142857143
c2b0d1f63dd6d6ec532b7cc2daf7c46e,9153,Ebola virus,Keith,Ord,A Retrospective Analysis of the Spatial and Temporal Patterns of the West African Ebola Epidemic; 2014-2015,NA,Geographical Analysis,2018,50,NA,337,357,FALSE,Reports projected final epidemic size,Yes,No,No,Yes,NA,NA,NA,9153,0,Ord 2018,1,50
0d7ddd8106171ef43abaee0b4727a692,9378,Ebola virus,Sylvie,Njankou,Modelling the potential impact of limited hospital beds on Ebola virus disease dynamics,10.1002/mma.4789,Mathematical Methods in the Applied Sciences,2018,41,NA,8528,8544,FALSE,NA,Yes,No,Yes,Yes,Yes,No,No,9378,0,Njankou 2018,0,57.14285714285714
4914d9a087eb8ddd8aa83763c2adc585,9546,Ebola virus,Denis,Ndanguza,Analysis of bias in an Ebola epidemic model by extended Kalman filter approach,10.1016/j.matcom.2017.05.005,Mathematics and Computers in Simulation,2017,142,NA,113,129,FALSE,NA,Yes,No,Yes,Yes,Yes,No,No,9546,0,Ndanguza 2017,0,57.14285714285714
37bd2a8ff933dd66a0e150ace05f3f74,10297,Ebola virus,Chinwendu,Madubueze,Global Stability of Ebola Virus Disease Model with Contact Tracing and Quarantine,NA,Applications and Applied Mathematics-an International Journal,2018,13,1,382,403,FALSE,NA,No,No,No,No,NA,NA,NA,10297,0,Madubueze 2018,1,0
204e2b80142cec05f6f4430ea26df49b,10440,Ebola virus,Elisa,Long,Spatial Resource Allocation for Emerging Epidemics:A Comparison of Greedy; Myopic; and Dynamic Policies,10.1287/msom.2017.0681,M&Som-Manufacturing & Service Operations Management,2018,20,2,181,198,FALSE,Spatial compartmental model.,No,No,No,No,No,No,No,10440,0,Long 2018,0,0
7d4f01282f5210c5013bfeb0cc54e59f,10487,Ebola virus,Shihao,Liu,Study on modeling simulation and optimal control method for the transmission risk of the Ebola virus,10.1177/0037549718757652,Simulation-Transactions of the Society for Modeling and Simulation International,2019,95,3,195,208,FALSE,SEIQR model.,No,No,No,No,NA,NA,NA,10487,0,Liu 2019,1,0
82e8630f36bba49819938c004331c828,10552,Ebola virus,Yanling,Li,The Ebola Outbreak Control Model Based on the Differential Equation,10.3303/cet1546215,Chemical Engineering Transactions,2015,46,NA,1285,1290,FALSE,Three stage compartmental models,No,No,No,No,NA,NA,NA,10552,0,Li 2015,1,0
fdf00efce1cf84d1f6230eda34cbd188,10805,Ebola virus,Ilknur,Koca,Modelling the spread of Ebola virus with Atangana-Baleanu fractional operators,10.1140/epjp/i2018-11949-4,European Physical Journal Plus,2018,133,3,NA,NA,FALSE,Not sure about this one; need to check.,No,No,No,No,NA,NA,NA,10805,0,Koca 2018,1,0
153ce90d58d1a908d206d2b4a63a0f9f,11129,Ebola virus,Romy,Kerber,Analysis of Diagnostic Findings From the European Mobile Laboratory in Gueckedou; Guinea; March 2014 Through March 2015,10.1093/infdis/jiw269,Journal of Infectious Diseases,2016,214,NA,NA,NA,FALSE,Blood samples from suspected EVD cases and then sequenced. CFR = fatalties/EVD cases with known outcome. Age and viral load (Ct values) significant adjusted risk factors. Looked at CFR by viral load; malaria comorbidity; and age.,Yes,No,NA,NA,No,Yes,No,11129,0,Kerber 2016,0,40
72da677a85c2c0b369a4020cf807ca5a,11297,Ebola virus,Li,Li,Transmission dynamics of Ebola virus disease with human mobility in Sierra Leone,10.1016/j.chaos.2017.09.022,Chaos Solitons & Fractals,2017,104,NA,575,579,FALSE,Spatial compartmental model. Susceptible; Exposed; Infectious; Hospitalized; Funeral and Recovered/Removed. 14 admin areas = patches. Flow within and between patches.,Yes,Yes,Yes,Yes,No,No,No,11297,0,Li 2017,0,57.14285714285714
fc44b3e198908f0aa505bb8b0c24949b,11421,Ebola virus,E.D.,Johnson,Haemorrhagic fever virus activity in equatorial Africa: distribution and prevalence of filovirus reactive antibody in the Central African Republic,10.1016/0035-9203(93)90075-2,Transactions of the Royal Society of Tropical Medicine and Hygiene,1993,87,5,530,535,FALSE,An IFAT study of seroprevalence; marked quality down due to poor description of the enlisted sample population.,Yes,Yes,NA,NA,Yes,No,No,11421,0,Johnson 1993,0,60
3a095a06c55b3fb0c805f2e7f48a45f1,11425,Ebola virus,B.K.,Johnson,Antibodies against haemorrhagic fever viruses in Kenya populations,10.1016/0035-9203(83)90216-x,Transactions of the Royal Society of Tropical Medicine and Hygiene,1983,77,5,731,733,FALSE,They tested for Zaire and Sudan variants; however they do not distinguish parameter for each.,Yes,No,NA,NA,Yes,No,No,11425,0,Johnson 1983,0,40
bfac2b8f6026532ed3f62ffbe8884be8,11467,Ebola virus,Z,Jezek,Ebola between outbreaks: Intensified Ebola hemorrhagic fever surveillance in the Democratic Republic of the Congo; 1981-1985,10.1086/514295,Journal of Infectious Diseases,1999,179,NA,60,64,FALSE,A seroprevalence survey that reports some other details. Quality it marked down due to some unclear choices in methodology and definition; but results are taken at face value.,Yes,No,NA,NA,No,No,No,11467,0,Jezek 1999,0,20
664b1e9b68c400d2cae0c532270d32f5,11565,Ebola virus,Mudassar,Imran,Modeling transmission dynamics of Ebola virus disease,10.1142/s1793524517500577,International Journal of Biomathematics,2017,10,4,NA,NA,FALSE,Quality marked down due to model not linking to which data they fit to; and it also appears to be cumulative data.,Yes,No,Yes,Yes,No,No,No,11565,0,Imran 2017,0,42.857142857142854
eabe76250841b83237f0cabdb735796c,11620,Ebola virus,Allen,Hunt,Exponential Growth in Ebola Outbreak since May 14; 2014,10.1002/cplx.21615,Complexity,2014,20,2,8,11,FALSE,This paper reads in the form of a commentary. Minimal methodological detail is given and no clear account of which data is fit to in generating R0 and CFR.,No,No,No,No,No,Yes,No,11620,0,Hunt 2014,0,14.285714285714285
2025e9300aeb5f4cf475fae4966eb26e,11688,Ebola virus,Liaquat,Hossain,Connecting the dots of Ebola spread dynamics,10.1080/12460125.2016.1187800,Journal of Decision Systems,2016,25,NA,274,289,FALSE,CFR is calculated in the introduction and not the main aim of the paper. No other params to extract.,No,No,No,No,No,No,No,11688,0,Hossain 2016,0,0
a36f886f3940046bc2ce6a6d81711d68,11995,Ebola virus,Ellina V,Grigorieva,Optimal Intervention Strategies for a SEIR Control Model of Ebola Epidemics,10.3390/math3040961,Mathematics,2015,3,4,961,983,FALSE,Their wording as to where the parameters come from is ambigious so assuming not fitted. Their control assumes you can get infected from someone who was exposed; so doesn't make sense…,Yes,No,No,No,NA,NA,NA,11995,0,Grigorieva 2015,1,25
6a0e88a777bc84297be353be04edd01b,11996,Ebola virus,Ellina V,Grigorieva,Optimal control problem for a SEIR type model of ebola epidemics,10.15517/rmta.v24i1.27771,REVISTA DE MATEMÁTICA: TEORÍA Y APLICACIONES,2017,24,1,79,96,FALSE,Very very similar to Cov ID: 11995; main addition is an isolation compartment; but even wording is verbatim is some parts. Their wording as to where the parameters come from is ambigious so assuming not fitted.,Yes,No,No,No,NA,NA,NA,11996,0,Grigorieva 2017,1,25
f1bb36e75e53beeb4117268a0c8133a7,11997,Ebola virus,Ellina V,Grigorieva,DETERMINATION OF THE OPTIMAL CONTROLS FOR AN EBOLA EPIDEMIC MODEL,10.3934/dcdss.2018062,Discrete and Continuous Dynamical Systems-Series S,2018,11,6,1071,1101,FALSE,Similar to 11997 but adds a Funeral compartment and corrects assumption that you can get infected from the control (present in the previous papers). Again; unclear whether parameters are fitted or not.,Yes,No,No,No,NA,NA,NA,11997,0,Grigorieva 2018,1,25
2979a1eef5f8da0b3f3fc7d82f9b89de,12045,Ebola virus,Grard,Gilda,Emergence of Divergent Zaire Ebola Virus Strains in Democratic Republic of the Congo in 2007 and 2008,10.1093/infdis/jir364,Journal of Infectious Diseases,2011,204,NA,776,784,FALSE,"Evolutionary rate given as approximate (~) and across a range of genomes.
Setting: patient’s home & hospital isolation wards",No,Yes,Yes,Yes,Yes,No,No,12045,0,Gilda 2011,0,57.14285714285714
e8ca2f08d61f9c103670a26ae0aa5ce9,12194,Ebola virus,Goufo,Emile Franc Doungmo,Stability analysis of epidemic models of Ebola hemorrhagic fever with non-linear transmission,10.22436/jnsa.009.06.61,Journal of Nonlinear Sciences and Applications,2016,9,6,4191,4205,FALSE,Other intervention: Immunistaion (included as a compartment),Yes,No,No,No,NA,NA,NA,12194,0,Emile Franc Doungmo 2016,1,25
cd9b83251c7c826c10fba793bcfe81e3,12237,Ebola virus,J., Gonzalez,Antibody prevalance against hemorrhagic-fever viruses in randomized representative central african populations,10.1016/s0923-2516(89)80112-8,Research in Virology,1989,140,4,319,331,FALSE,NA,Yes,Yes,No,No,Yes,No,No,12237,0, Gonzalez 1989,0,42.857142857142854
fe8eaf179d6802fb9cb4ae2698899b3f,12389,Ebola virus,Tapiwa,Ganyani,Assessing the relationship between epidemic growth scaling and epidemic size: The 2014-16 Ebola epidemic in West Africa,10.1017/s0950268818002819,Epidemiology and Infection,2019,6,4,1685,1706,FALSE,Use generalised growth model (GGM); fitted to data using Bayesian maximum likelihood estimation.,NA,NA,NA,NA,NA,NA,NA,12389,0,Ganyani 2019,1,NA
d551d9750ae2073154949a26c062eb1a,12609,Ebola virus,Arindam,Fadikar,Calibrating a Stochastic; Agent-Based Model Using Quantile-Based Emulation,10.1137/17m1161233,Siam-Asa Journal on Uncertainty Quantification,2018,6,4,1685,1706,FALSE,NA,Yes,Yes,Yes,Yes,NA,NA,NA,12609,0,Fadikar 2018,1,100
cb0c0f201eac6a0dd47dc08c1b55fa8f,12715,Ebola virus,Alain-Jean,Georges,Ebola hemorrhagic fever outbreaks in Gabon; 1994-1997: Epidemiologic and health control issues,10.1086/514290,Journal of Infectious Diseases,1999,179,NA,65,75,FALSE,Article appears to be in the supplement of this Issue; not main Issue.,Yes,Yes,NA,NA,No,Yes,Yes,12715,0,Georges 1999,0,80
304d4e17284ce948768fcc0bb9800754,13183,Ebola virus,Chinyere,Dike,Susceptible Infected Removed Epidemic Model Extension for Efficient Analysis of Ebola Virus Disease Transmission,10.1166/asl.2017.10033,Advanced Science Letters,2017,23,NA,9107,9114,TRUE,NA,No,No,No,Yes,NA,NA,NA,13183,0,Dike 2017,1,25
b1a1d285cf2734caae7c111fd0985e24,13198,Ebola virus,Paul,Diaz,A modified SEIR model for the spread of Ebola in Western Africa and metrics for resource allocation,10.1016/j.amc.2017.11.039,Applied Mathematics and Computation,2018,324,NA,141,155,FALSE,Estimated time to hospitalization and time to proper burial disaggregated by region also available but unclear from what.,Yes,No,Yes,Yes,Yes,Yes,Yes,13198,0,Diaz 2018,0,85.71428571428571
92fa3908f4c90beb5e8162928446764c,13539,Ebola virus,Nan,Chen,Bilevel Optimization Model for the Development of Real-Time Strategies to Minimize Epidemic Spreading Risk in Air Traffic Networks,10.3141/2569-07,Transportation Research Record,2016,2569,1,NA,NA,FALSE,Network model where each node is a region that is either susceptible or infected.,Yes,No,Yes,No,NA,NA,NA,13539,0,Chen 2016,1,50
927364da3bea851d3f5f1951583a5d09,13681,Ebola virus,M,De la Sen,On a New Epidemic Model with Asymptomatic and Dead-Infective Subpopulations with Feedback Controls Useful for Ebola Disease,10.1155/2017/4232971,Discrete Dynamics in Nature and Society,2017,NA,NA,NA,NA,FALSE,SEIADR. A = asymomatic infectious. D = dead infective.,Yes,Yes,Yes,Yes,NA,NA,NA,13681,0,De la Sen 2017,1,100
653efac9b832d6dee10e7d0e408d565d,13964,Ebola virus,M,Bwaka,Ebola hemorrhagic fever in Kikwit; Democratic Republic of the Congo: Clinical observations in 103 patients,10.1086/514308,The Journal of Infectious Diseases,1999,179,NA,NA,NA,FALSE,Issue supplement 1 pages S1-S7 (can't enter characters in above fields),Yes,Yes,Yes,Yes,Yes,Yes,No,13964,0,Bwaka 1999,0,85.71428571428571
2476d3309e4b7c5456d14f4cdfec4e95,13965,Ebola virus,İ. Esra,Buyuktahtakin,A new epidemics–logistics model: Insights into controlling the Ebola virus disease in West Africa,10.1016/j.ejor.2017.08.037,European Journal of Operational Research,2018,265,3,1046,1063,FALSE,Considers treatment capacity and spatial factors.,Yes,Yes,Yes,No,NA,NA,NA,13965,0,Buyuktahtakin 2018,1,75
c9c3ce913607a6989eab26390007a874,13981,Ebola virus,KM,Busico,Prevalence of IgG antibodies to Ebola virus in individuals during an Ebola outbreak; Democratic Republic of the Congo; 1995,10.1086/514309,Journal of Infectious Diseases,1999,179,NA,NA,NA,FALSE,NA,Yes,No,NA,NA,Yes,Yes,No,13981,0,Busico 1999,0,60
a42a1d22403859304b6917ee25d33fea,14004,Ebola virus,Emily,Burkhead,A cellular automata model of Ebola virus dynamics,10.1016/j.physa.2015.06.049,Physica a-Statistical Mechanics and Its Applications,2015,438,NA,424,435,FALSE,NA,No,No,No,No,NA,NA,NA,14004,0,Burkhead 2015,1,0
b92250acc40a63f830bc0b46f03429ad,14484,Ebola virus,Yusuke,Asai,JOINT ESTIMATION OF THE TRANSMISSIBILITY AND SEVERITY OF EBOLA VIRUS DISEASE IN REAL TIME,10.1142/s0218339017400022,Journal of Biological Systems,2017,25,4,587,603,FALSE,NA,Yes,No,No,No,Yes,No,No,14484,0,Asai 2017,0,28.57142857142857
1d5e99ad5c711272e7503c025157762f,14514,Ebola virus,Ivan,Area,EBOLA MODEL AND OPTIMAL CONTROL WITH VACCINATION CONSTRAINTS,10.3934/jimo.2017054,Journal of Industrial and Management Optimization,2018,14,2,427,446,FALSE,NA,No,No,No,No,NA,NA,NA,14514,0,Area 2018,1,0
a24182e1fd303b71c193c05b7cd07de4,14516,Ebola virus,Ivan,"Area
Area",On a fractional order Ebola epidemic model,10.1186/s13662-015-0613-5,Advances in Difference Equations,2015,2015,278,NA,NA,FALSE,Technically fitted to data in the loosest sense of the term,Yes,No,No,No,NA,NA,NA,14516,0,"Area
Area 2015",1,25
0a14c74e13f52bb5252a49580d9d8d03,15092,Ebola virus,C., Bhunu,Effects of pre-exposure vaccination and quarantine in the fight against ebola,NA,Cogent Biology,2016,2,1,NA,NA,FALSE,NA,Yes,Yes,Yes,Yes,NA,NA,NA,15092,0, Bhunu 2016,1,100
d505847f7396223cfedfc1bcba8629ec,15136,Ebola virus,T,Berge,Mathematical modeling of contact tracing as a control strategy of Ebola virus disease,10.1142/s1793524518500936,International Journal of Biomathematics,2018,11,7,NA,NA,TRUE,NA,Yes,Yes,Yes,Yes,NA,NA,NA,15136,0,Berge 2018,1,100
2ad389ce3046b2d54f19144cdfb53cbe,15138,Ebola virus,Tsanou,Berge,Dynamics of host-reservoir transmission of Ebola with spillover potential to humans,10.14232/ejqtde.2018.1.14,Electronic Journal of Qualitative Theory of Differential Equations,2018,NA,14,1,32,FALSE,NA,Yes,Yes,Yes,Yes,NA,NA,NA,15138,0,Berge 2018,1,100
c8914a927d21d1bd5796245da290a467,15139,Ebola virus,T,Berge,A MATHEMATICAL MODEL FOR EBOLA EPIDEMIC WITH SELF-PROTECTION MEASURES,10.1142/s0218339018500067,Journal of Biological Systems,2018,26,1,107,131,TRUE,NA,Yes,Yes,Yes,Yes,NA,NA,NA,15139,0,Berge 2018,1,100
1e68195a6703e25c86e45defeead3a52,15321,Ebola virus,Z,Abbasi,Optimal Control Design of Impulsive SQEIAR Epidemic Models with Application to COVID-19,10.1016/j.chaos.2020.110054,Chaos; Solitons & Fractals,2020,139,NA,NA,NA,FALSE,The model is theoretical only for ebola as it is applied to covid data,Yes,Yes,No,Yes,NA,NA,NA,15321,0,Abbasi 2020,1,75
a7951854f53dddfb1cbd83d6e70b3714,15365,Ebola virus,JO,Agbomola,Modelling the impact of some control strategies on the transmission dynamics of Ebola virus in human-bat population: An optimal control analysis,10.1016/j.heliyon.2022.e12121,Heliyon,2022,NA,NA,NA,NA,FALSE,NA,No,Yes,No,Yes,NA,NA,NA,15365,0,Agbomola 2022,1,50
98adbf41c5fef18a351ee6b008c5ce20,15388,Ebola virus,AR,Akhmetzhanov,Analyzing and forecasting the Ebola incidence in North Kivu; the Democratic Republic of the Congo from 2018–19 in real time,10.1016/j.epidem.2019.05.002,Epidemics,2019,27,NA,123,131,FALSE,Have reporting delay estimates.,Yes,Yes,Yes,Yes,Yes,Yes,Yes,15388,0,Akhmetzhanov 2019,0,100
193d9081625be763b81932124e7cbfb0,15434,Ebola virus,AR,Alusio,Vitamin A Supplementation Was Associated with Reduced Mortality in Patients with Ebola Virus Disease during the West African Outbreak,10.1093/jn/nxz142,The Journal of Nutrition,2019,149,10,1757,1765,FALSE,NA,Yes,Yes,Yes,Yes,Yes,Yes,Yes,15434,0,Alusio 2019,0,100
3840d0b9d872a3123272f366cd62cd00,15436,Ebola virus,Adam,Aluisio,Impact of Intravenous Fluid Therapy on Survival among Patients with Ebola Virus Disease: An International Multisite Retrospective Cohort Study,10.1093/cid/ciz344,Clinical Infectious Diseases,2020,70,6,1038,1047,FALSE,This paper reports deaths and cases; but not explicitly CFR; they report  patient survival rate (41.7%); I haven't included this.,Yes,Yes,Yes,Yes,Yes,Yes,Yes,15436,0,Aluisio 2020,0,100
8967b8b46dc1d3257558339743f61484,15448,Ebola virus,Fiifi,Johnson,Geospatial clustering and correlates of deaths during the Ebola outbreak in Liberia: a Bayesian geoadditive semiparametric analysis of nationally representative cross-sectional survey data,10.1136/bmjopen-2021-054095,BMJ Open,2022,12,6,NA,NA,FALSE,Risk factors for reporting death of a household member or relative.,Yes,Yes,Yes,Yes,Yes,Yes,Yes,15448,0,Johnson 2022,0,100
6362fbb2435b887f9c08d9732b3377a6,15544,Ebola virus,April,Baller,Ebola virus disease nosocomial infections in the Democratic Republic of the Congo: a descriptive study of cases during the 2018–2020 outbreak,10.1016/j.ijid.2021.11.039,International Journal of Infectious Diseases,2022,115,NA,126,133,FALSE,Symptom onset to reporting delay text average: 8.2; sd: 12.3; but in table 2 appears to be 7.6 with sd = 6. I have included the text average as primary with a range over dissagregated values in table. Medians also reported in table.,No,No,No,No,No,No,No,15544,0,Baller 2022,0,0
4f26ae0cbb0e1d5047df62fe7411d361,15555,Ebola virus,S,Bane,Ebola Virus IgG Seroprevalence in Southern Mali,10.3201/eid2706.203510,Emerging Infectious Disease,2021,27,6,1681,1684,FALSE,NA,Yes,No,NA,NA,No,Yes,No,15555,0,Bane 2021,0,40
61973f86ce47a16ffdf0e752876b5c60,15657,Ebola virus,Vinod,Bhardwaj,A Reliable Solution of Nonlinear Time Dependent Fractional Model of Ebola Virus Disease with Arbitrary Order Derivative in Liouville–Caputo Sense,10.1007/s40819-021-01200-5,"International Journal of Applied and Computational Mathematics
International Journal of Applied and Computational Mathematics 
International Journal of Applied and Computational Mathematics
International Journal of Applied and Computational Mathematics",2021,7,257,NA,NA,FALSE,NA,Yes,No,No,No,NA,NA,NA,15657,0,Bhardwaj 2021,1,25
a2124af76d6dda14db99055be3b97bad,15660,Ebola virus,S,Bhatia,Using digital surveillance tools for near real-time mapping of the risk of infectious disease spread,10.1038/s41746-021-00442-3,npj Digital Medicine,2021,4,73,NA,NA,FALSE,Has relative risk of importation to different countries in west Africa,Yes,Yes,Yes,Yes,Yes,Yes,Yes,15660,0,Bhatia 2021,0,100
669121e44254bf8ee0a2e284b5ec4194,15673,Ebola virus,D,Bisanzio,Targeted preventive vaccination campaigns to reduce Ebola outbreaks: An individual-based modeling study,10.1016/j.vaccine.2022.11.036,Vaccine,2023,41,3,684,693,FALSE,NA,NA,NA,Yes,Yes,NA,NA,NA,15673,0,Bisanzio 2023,1,100
b996791fdfc33a1e5614978ba282f631,15735,Ebola virus,A,Bouba,Predicting the combined effects of case isolation; safe funeral practices; and contact tracing during Ebola virus disease outbreaks,10.1371/journal.pone.0276351,PLoS One,2023,18,1,NA,NA,FALSE,NA,NA,NA,No,Yes,NA,NA,NA,15735,0,Bouba 2023,1,50
30562ee62dfebc875005a8b1c9ca570f,15764,Ebola virus,A,Bratcher,Zoonotic risk factors associated with seroprevalence of Ebola virus GP antibodies in the absence of diagnosed Ebola virus disease in the Democratic Republic of Congo,10.1371/journal.pntd.0009566,PLoS Neglected Tropical Diseases,2021,15,8,NA,NA,FALSE,NA,Yes,Yes,Yes,Yes,Yes,Yes,Yes,15764,0,Bratcher 2021,0,100
90cda0167b9fb01bb121095073bb076b,15896,Ebola virus,Yat,Chan,Estimating the protective effect of case isolation with transmission tree reconstruction during the Ebola outbreak in Nigeria; 2014,10.1098/rsif.2020.0498,Journal of the Royal Society Interface,2020,17,NA,NA,NA,FALSE,The humdan delays in this article are all parameterised by the distribution mean and standard deviation  There was no standard devition option in the dropdown so I selected Mean sd; so this will have to be corrected. This will be added to future databases,Yes,Yes,Yes,Yes,Yes,Yes,No,15896,0,Chan 2020,0,85.71428571428571
1961e1ed6c76c6e5734373c590cbba16,15901,Ebola virus,Michael,Chapwanya,Analysis of War and Conflict Effect on the Transmission Dynamics of the Tenth Ebola Outbreak in the Democratic Republic of the Congo,10.1007/s11538-022-01094-4,Bulletin of Mathematical Biology,2022,84,136,NA,NA,FALSE,NA,Yes,Yes,Yes,Yes,NA,NA,NA,15901,0,Chapwanya 2022,1,100
4d998264d464a2cfff7807424ab5f17e,15924,Ebola virus,Peiyu,Chen,A hybrid simulation model to study the impact of combined interventions on Ebola Epidemic,10.1371/journal.pone.0254044,PLoS ONE,2021,16,7,NA,NA,FALSE,Hybrid model (compartmental + ABM) tests vaccination and education of health care workers about Ebola and vaccination. This model is used to estimate R0.,Yes,Yes,Yes,Yes,Yes,No,No,15924,0,Chen 2021,0,71.42857142857143
bb8037bb04bc1ba432b215761cbfdab6,15947,Ebola virus,Boseung,Choi,Modeling outbreak data: Analysis of a 2012 Ebola virus disease epidemic in DRC,10.11145/j.biomath.2019.10.037,Biomath,2019,8,NA,NA,NA,FALSE,NA,Yes,No,Yes,No,Yes,No,No,15947,0,Choi 2019,0,42.857142857142854
06a109603bd242876fb54f9fb292c924,15958,Ebola virus,Gerardo,Chowell,A novel sub-epidemic modeling framework for short-term forecasting epidemic waves,10.1186/s12916-019-1406-6,BMC Medicine,2019,17,1,164,NA,FALSE,units of growth rate are (people)^(1-p) per unit of time,Yes,Yes,Yes,Yes,Yes,Yes,No,15958,0,Chowell 2019,0,85.71428571428571
